,id,info
1672,191983,"eos: an extensible object store alexandros biliris, euthimios panagos 1994"
1673,191986,"the myriad federated database prototype s.-y. hwang, e.-p. lim, h.-r. yang, s. musukula, k. mediratta, m. ganesh, d. clements, j. stenoien, j. srivastava 1994"
1674,191988,"genesys: a system for efficient spatial query processing thomas brinkhoff, hans-peter kriegel, ralf schneider, bernhard seeger 1994"
1675,191989,open object database management systems jos&#233; a. blakeley 1994
1676,191970,"xsb as a deductive database konstantinos sagonas, terrance swift, david s. warren 1994"
1677,191972,"quest: a project on database mining r. agrawal, m. carey, c. faloutsos, s. ghosh, m. houtsma, t. imieli&#324;ski, b. iyer, a. mahboob, h. miranda, r. srikant, a. swami 1994"
1678,191976,"query by diagram: a graphical environment for querying databases tiziana catarci, giuseppe santucci 1994"
1679,191979,"dblearn: a system prototype for knowledge discovery in relational databases jiawei han, yongjian fu, yue huang, yandong cai, nick cercone 1994"
1680,187445,how to modify sql queries in order to guarantee sure answers h.-j. klein 1994
1681,187442,research issues in databases for arcs: active rapidly changing data systems anindya datta 1994
1682,187439,"response to the odmg-93 commentary written by dr. won kim of unisql, inc. corporate object database management group 1994"
1683,185854,"formal aspects of concurrency control in long-duration transaction systems using the nt/pv model henry f. korth, greg speegle 1994"
1684,187455,"the impact of database research on industrial products (panel) jos&#233; a. blakeley, dan fishman, david lomet, michael stonebraker 1994"
1685,187454,"announcement-the temporal query language tsql2 final language definition richard thomas snodgrass, ilsoo ahn, gad ariav, don batory, james clifford, curtis e. dyreson, ramez elmasri, fabio grandi, christian s. jensen, wolfgang k&#228;fer, nick kline, krishna kulkarni, t. y. cliff leung, nikos lorentzos, john f. roddick, arie segev, michael d. soo, suryanarayana m. sripada 1994"
1686,187449,"a tsql2 tutorial richard thomas snodgrass, ilsoo ahn, gad ariav, don batory, james clifford, curtis e. dyreson, ramez elmasri, fabio grandi, christian s. jensen, wolfgang k&#228;fer, nick kline, krishna kulkarni, t. y. cliff leung, nikos lorentzos, john f. roddick, arie segev, michael d. soo, suryanarayana m. sripada 1994"
1687,187447,"performance evaluation of a new distributed deadlock detection algorithm chim-fu yeung, sheung-lun hung, kam-yiu lam 1994"
1688,187462,jumping on the nii bandwagon xiaolei qian 1994
1689,187460,database research at nthu and itri arbee l. p. chen 1994
1690,187458,"medical information systems: characterization and challenges jorge c. g. ramirez, lon a. smith, lynn l. peterson 1994"
1691,187457,research issues in active database systems: report from the closing panel at ride-ads '94 jennifer widom 1994
1692,190635,"metadata for multimedia documents klemens b&#246;hm, thomas c. rakow 1994"
1693,190633,"a new join algorithm dong keun shin, arnold charles meltzer 1994"
1694,190631,data modelling in the large martin bertram 1994
1695,190628,are the terms version and variant orthogonal to one another? hartmut wedekind 1994
1696,181555,"supporting dynamic displays using active rules oscar d&#237;az, arturo jaime, norman w. paton, ghassan al-qaimari 1994"
1697,181556,"constructing the next 100 database management systems: like the handyman or like the engineer? andreas geppert, klaus r. dittrich 1994"
1698,181553,"research perspectives for time series management systems werner dreyer, angelika kotz dittrich, duri schmidt 1994"
1699,181554,a hypertext query language for images li yang 1994
1700,181562,"tsql2 language specification richard thomas snodgrass, ilsoo ahn, gadi ariav, don batory, james clifford, curtis e. dyreson, ramez elmasri, fabio grandi, christian s. jensen, wolfgang k&#228;fer, nick kline, krishna kulkarni, t. y. cliff leung, nikos lorentzos, john f. roddick, arie segev, michael d. soo, suryanarayana m. sripada 1994"
1701,181564,"comprehension syntax peter buneman, leonid libkin, dan suciu, val tannen, limsoon wong 1994"
1702,181557,"towards an infrastructure for temporal databases: report of an invitational arpa/nsf workshop niki pissinou, richard thomas snodgrass, ramez elmasri, inderpal s. mumick, tamer &#214;zsu, barbara pernici, arie segev, babis theodoulidis, umeshwar dayal 1994"
1703,181560,"a consensus glossary of temporal database concepts curtis dyreson, fabio grandi, wolfgang k&#228;fer, nick kline, nikos lorentzos, yannis mitsopoulos, angelo montanari, daniel nonen, elisa peressi, barbara pernici, john f. roddick, nandlal l. sarda, maria rita scalas, arie segev, richard thomas snodgrass, mike d. soo, abdullah tansel, paolo tiberio, gio wiederhold 1994"
1704,181567,"the database research group at eth zurich moira c. norrie, stephen m. blott, hans-j&#246;rg schek, gerhard weikum 1994"
1705,181568,influencing database language standards leonard gallagher 1994
1706,181565,text databases: a survey of text models and systems arjan loeffen 1994
1707,181566,"databases for gis claudia bauzer medeiros, fatima pires 1994"
1708,185836,"evaluation of remote backup algorithms for transaction-processing systems christos a. polyzois, h&#233;ctor garc&#237;a-molina 1994"
1709,185843,"synthesis of extended transaction models using acta panos k. chrysanthis, krithi ramamritham 1994"
1710,181569,progress on hpcc and nii marianne winslett 1994
1711,185828,"automatic generation of production rules for integrity maintenance stefano ceri, piero fraternali, stefano paraboschi, letizia tanca 1994"
1712,191856,"data modeling of time-based media simon gibbs, christian breiteneder, dennis tsichritzis 1994"
1713,191852,"staggered striping in multimedia information systems steven berson, shahram ghandeharizadeh, richard muntz, xiangyu ju 1994"
1714,191863,"combinatorial pattern discovery for scientific data: some preliminary results jason tsong-li wang, gung-wei chirn, thomas g. marr, bruce shapiro, dennis shasha, kaizhong zhang 1994"
1715,191860,"implementation of magic-sets in a relational database system inderpal singh mumick, hamid pirahesh 1994"
1716,191870,"incomplete path expressions and their disambiguation yannis e. ioannidis, yezdi lashkari 1994"
1717,191869,"the effectiveness of gioss for the text database discovery problem luis gravano, h&#233;ctor garc&#237;a-molina, anthony tomasic 1994"
1718,191874,"adaptive selectivity estimation using query feedback chungmin melvin chen, nick roussopoulos 1994"
1719,191872,"optimization of dynamic query evaluation plans richard l. cole, goetz graefe 1994"
1720,191879,"on parallel execution of multiple pipelined hash joins hui-i hsiao, ming-syan chen, philip s. yu 1994"
1721,191877,"estimating page fetches for index scans with finite lru buffers arun swami, k. bernhard schiefer 1994"
1722,191881,"spatial joins using seeded trees ming-ling lo, chinya v. ravishankar 1994"
1723,191880,"multi-step processing of spatial joins thomas brinkhoff, hans-peter kriegel, ralf schneider, bernhard seeger 1994"
1724,191884,"alphasort: a risc machine sort chris nyberg, tom barclay, zarka cvetanovic, jim gray, dave lomet 1994"
1725,191882,"managing memory for real-time queries hwee hwa pang, michael j. carey, miron livny 1994"
1726,191889,"distributed file organization with scalable cost/performance radek vingralek, yuri breitbart, gerhard weikum 1994"
1727,191886,"quickly generating billion-record synthetic databases jim gray, prakash sundaresan, susanne englert, ken baclawski, peter j. weinberger 1994"
1728,190638,"metadata in video databases ramesh jain, arun hampapur 1994"
1729,190639,"a metadatabase system for semantic image search by a mathematical model of meaning yasushi kiyoki, takashi kitagawa, takanari hayama 1994"
1730,190642,"sequoia 2000 metadata schema for satellite images jean t. anderson, michael stonebraker 1994"
1731,190644,"using metadata for the intelligent browsing of structured media objects william i. grosky, farshad fotouhi, ishwar k. sethi, bogdan capatina 1994"
1732,190645,"metadata for integrating speech documents in a text retrieval system ulrike glavitsch, peter sch&#228;uble, martin wechsler 1994"
1733,190646,"metadata for mixed-media access francine chen, marti hearst, julian kupiec, jan pedersen, lynn wilcox 1994"
1734,190647,"loading databases using dataflow parallelism tom barclay, robert barnes, jim gray, prakash sundaresan 1994"
1735,190648,"recent design trade-offs in sql3 nelson mattos, linda g. demichiel 1994"
1736,190649,unix rdbms: the next generation what are the unix relational-database vendors doing to survive in the next generation of client/server environments bill rosenblatt 1994
1737,191844,"sleepers and workaholics: caching strategies in mobile environments daniel barbar&#225;, tomasz imieli&#324;ski 1994"
1738,191845,"data replication for mobile computers yixiu huang, prasad sistla, ouri wolfson 1994"
1739,191846,"energy efficient indexing on air tomasz imielinski, s. viswanathan, b. r. badrinath 1994"
1740,191847,sigmod challenges paper: database issues in telecommunications network management ilsoo ahn 1994
1741,191848,"asset: a system for supporting extended transactions a. biliris, s. dar, n. gehani, h. v. jagadish, k. ramamritham 1994"
1742,191849,"aries/csa: a method for database recovery in client-server architectures c. mohan, inderpal narang 1994"
1743,191850,"ensuring relaxed atomicity for flexible transactions in multidatabase systems aidong zhang, marian nodine, bharat bhargava, omran bukhres 1994"
1744,271093,"virtual database technology ashish gupta, venky harinarayan, anand rajaraman 1997"
1745,271089,"research issues in federated database systems: report of efdbs '97 workshop s. conrad, b. eaglestone, w. hasselbring, m. roantree, m. sch&#246;hoff, m. str&#228;ssler, m. vermeer, f. saltor 1997"
1746,271095,"information systems research at george mason university sushil jajodia, daniel barbar&#225;, alex brodsky, larry kerschberg, ami motro, edgar sibley, x. sean wang 1997"
1747,271094,"the five-minute rule ten years later, and other computer storage rules of thumb jim gray, goetz graefe 1997"
1748,271083,"extracting entity profiles from semistructured information spaces robert a. nado, scott b. huffman 1997"
1749,271082,"integrating dynamically-fetched external information into a dbms for semistructured data jason mchugh, jennifer widom 1997"
1750,271087,"workshop on workflow management in scientific and engineering applications-report r. mcclatchey, g. vossen 1997"
1751,271084,"inferring structure in semistructured data svetlozer nestorov, serge abiteboul, rajeev motwani 1997"
1752,271077,management of semistructured data dan suciu 1997
1753,262771,"research in databases and data-intensive applications: computer science dept. and fiz, university of karlsruhe brigitta k&#246;nig-ries, peter c. lockermann 1997"
1754,271080,"semistructured and structured data in the web: going back and forth paolo atzeni, giansalvatore mecca, paolo merialdo 1997"
1755,271078,"wrapper generation for semi-structured internet sources naveen ashish, craig a. knoblock 1997"
1756,262768,"database systems-breaking out of the box avi silberschatz, stan zdonik 1997"
1757,262767,"asserting beliefs in mls relational models nenad a. jukic, susan v. vrbsky 1997"
1758,262770,"lore: a database management system for semistructured data jason mchugh, serge abiteboul, roy goldman, dallas quass, jennifer widom 1997"
1759,262769,"report on dart '96: databases: active and real-time (concepts meet practice) krithi ramamritham, nandit soparkar 1997"
1760,273270,where will object technology drive data administration? arnon rosenthal 1998
1761,273271,repositories and object oriented databases philip a. bernstein 1998
1762,273273,towards on-line analytical mining in large databases jiawei han 1998
1763,274461,"intelligent access to heterogeneous information sources: report on the 4th workshop on knowledge representation meets databases franz baader, manfred a. jeusfeld, werner nutt 1997"
1764,273258,"an extensible notation for spatiotemporal index queries vassilis j. tsotras, christian s. jensen, richard thomas snodgrass 1998"
1765,273264,"t2: a customizable parallel database for multi-dimensional data chialin chang, anurag acharya, alan sussman, joel saltz 1998"
1766,273265,"workflow history management pinar koksal, sena nural arpinar, asuman dogac 1998"
1767,273267,towards a richer web object model frank manola 1998
1768,273253,materialized views and data warehouses nick roussopoulos 1998
1769,273254,"applications of java programming language to database management bradley f. burton, victor w. marek 1998"
1770,273255,"unbundling active functionality stella gatziu, arne koschel, g&#252;nter von b&#252;ltzingsloewen, hans fritschi 1998"
1771,273257,"mining fuzzy association rules in databases chan man kuok, ada fu, man hon wong 1998"
1772,271096,"the database and information system research group at the university of ulm peter dadam, wolfgang klas 1997"
1773,273247,workshop report on experiences using object data management in the real-world akmal b. chaudhri 1998
1774,273249,"report on the second ieee metadata conference (metadata '97) ron musick, chris miller 1998"
1775,273251,predator: a resource for database research praveen seshadri 1998
1776,276321,"your mediators need data conversion! sophie cluet, claude delobel, j&#233;r&#466;me sim&#233;on, katarzyna smaga 1998"
1777,276320,"dimensionality reduction for similarity searching in dynamic databases k. v. ravi kanth, divyakant agrawal, ambuj singh 1998"
1778,276319,"optimal multi-step k-nearest neighbor search thomas seidl, hans-peter kriegel 1998"
1779,276318,"the pyramid-technique: towards breaking the curse of dimensionality stefan berchtold, christian b&#246;hm, hans-peter kriegal 1998"
1780,276317,"cost-based query scrambling for initial delays tolga urhan, michael j. franklin, laurent amsaleg 1998"
1781,276316,"interaction of query evaluation and buffer management for information retrieval bj&#246;rn t. j&#243;nsson, michael j. franklin, divesh srivastava 1998"
1782,276315,"efficient mid-query re-optimization of sub-optimal query execution plans navin kabra, david j. dewitt 1998"
1783,276314,"automatic subspace clustering of high dimensional data for data mining applications rakesh agrawal, johannes gehrke, dimitrios gunopulos, prabhakar raghavan 1998"
1784,276313,"efficiently mining long patterns from databases roberto j. bayardo, jr. 1998"
1785,276312,"cure: an efficient clustering algorithm for large databases sudipto guha, rajeev rastogi, kyuseok shim 1998"
1786,276311,"changing the rules: transformations for rule-based optimizers mitch cherniack, stan zdonik 1998"
1787,276310,query unnesting in object-oriented databases leonidas fegaras 1998
1788,276309,"reusing invariants: a new strategy for correlated queries jun rao, kenneth a. ross 1998"
1789,276308,"parallel mining algorithms for generalized association rules with classification hierarchy takahiko shintani, masaru kitsuregawa 1998"
1790,276307,"exploratory mining and pruning optimizations of constrained associations rules raymond t. ng, laks v. s. lakshmanan, jiawei han, alex pang 1998"
1791,276306,"query flocks: a generalization of association-rule mining dick tsur, jeffrey d. ullman, serge abiteboul, chris clifton, rajeev motwani, svetlozar nestorov, arnon rosenthal 1998"
1792,276336,"bitmap index design and evaluation chee-yong chan, yannis e. ioannidis 1998"
1793,276337,"autoadmin what-if index analysis utility surajit chaudhuri, vivek narasayya 1998"
1794,276334,"new sampling-based summary statistics for improving approximate query answers phillip b. gibbons, yossi matias 1998"
1795,276335,"integrating association rule mining with relational database systems: alternatives and implications sunita sarawagi, shiby thomas, rakesh agrawal 1998"
1796,276332,"enhanced hypertext categorization using hyperlinks soumen chakrabarti, byron dom, piotr indyk 1998"
1797,276333,"cost-based optimization of decision support queries using transient-views subbu n. subramanian, shivakumar venkataraman 1998"
1798,276330,nodose-a tool for semi-automatically extracting structured and semistructured data from text documents brad adelberg 1998
1799,276331,"extracting schema from semistructured data svetlozar nestorov, serge abiteboul, rajeev motwani 1998"
1800,276328,"caching multidimensional queries using chunks prasad m. deshpande, karthikeyan ramasamy, amit shukla, jeffrey f. naughton 1998"
1801,276329,"simultaneous optimization and evaluation of multiple dimensional queries yihong zhao, prasad m. deshpande, jeffrey f. naughton, amit shukla 1998"
1802,276326,"incremental distance join algorithms for spatial databases g&#237;sli r. hjaltason, hanan samet 1998"
1803,276327,"an alternative storage organization for rolap aggregate views based on cubetrees yannis kotidis, nick roussopoulos 1998"
1804,276324,"the dedale system for complex spatial queries st&#233;phane grumbach, philippe rigaux, luc segoufin 1998"
1805,276325,"similarity query processing using disk arrays apostolos n. papadopoulos, yannis manolopoulos 1998"
1806,276322,using schematically heterogeneous structures re&#233;e j. miller 1998
1807,276323,integration of heterogeneous databases without common domains using queries based on textual similarity william w. cohen 1998
1808,253304,"a framework for implementing hypothetical queries timothy griffin, richard hull 1997"
1809,253302,"on saying enough already! in sql michael j. carey, donald kossmann 1997"
1810,253325,"dynamic itemset counting and implication rules for market basket data sergey brin, rajeev motwani, jeffrey d. ullman, shalom tsur 1997"
1811,253322,"high-performance sorting on networks of workstations andrea c. arpaci-dusseau, remzi h. arpaci-dusseau, david e. culler, joseph m. hellerstein, david a. patterson 1997"
1812,253330,"scalable parallel data mining for association rules eui-hong han, george karypis, vipin kumar 1997"
1813,253327,"beyond market baskets: generalizing association rules to correlations sergey brin, rajeev motwani, craig silverstein 1997"
1814,253335,"devise: integrated querying and visual exploration of large datasets m. livny, r. ramakrishnan, k. beyer, g. chen, d. donjerkovic, s. lawande, j. myllymaki, k. wenger 1997"
1815,253332,"efficiently supporting ad hoc queries in large datasets of time sequences flip korn, h. v. jagadish, christos faloutsos 1997"
1816,253283,"the bucky object-relational benchmark michael j. carey, david j. dewitt, jeffrey f. naughton, mohammad asgarian, paul brown, johannes e. gehrke, dhaval n. shah 1997"
1817,253280,"database performance in the real world: tpc-d and sap r/3 joachen doppelhammer, thomas h&#246;ppler, alfons kemper, donald kossmann 1997"
1818,253288,"an array-based algorithm for simultaneous multidimensional aggregates yihong zhao, prasad m. deshpande, jeffrey f. naughton 1997"
1819,253287,"the strip rule system for efficiently maintaining derived data brad adelberg, hector garcia-molina, jennifer widom 1997"
1820,253293,"balancing push and pull for data broadcast swarup acharya, michael franklin, stanley zdonik 1997"
1821,253291,"online aggregation joseph m. hellerstein, peter j. haas, helen j. wang 1997"
1822,253299,"starts: stanford proposal for internet meta-searching luis gravano, chen-chuan k. chang, h&#233;ctor garc&#237;a-molina, andreas paepcke 1997"
1823,253294,"infosleuth: agent-based semantic integration of information in open and dynamic environments r. j. bayardo, jr., w. bohrer, r. brice, a. cichocki, j. fowler, a. helal, v. kashyap, t. ksiezyk, g. martin, m. nodine, m. rashid, m. rusinkiewicz, r. shea, c. unnikrishnan, a. unruh, d. woelk 1997"
1824,253353,"supporting multiple view maintenance policies latha s. colby, akira kawaguchi, daniel f. lieuwen, inderpal singh mumick, kenneth a. ross 1997"
1825,253355,"efficient view maintenance at data warehouses d. agrawal, a. el abbadi, a. singh, t. yurek 1997"
1826,253357,"eliminating costly redundant computations from sql trigger executions fran&#231;ois llirbat, fran&#231;oise fabret, eric simon 1997"
1827,253359,"temporal aggregation in active database rules iakovos motakis, carlo zaniolo 1997"
1828,253361,"association rules over interval data r. j. miller, y. yang 1997"
1829,253362,"secure transaction processing in firm real-time database systems binto george, jayant haritsa 1997"
1830,253364,"a unified framework for enforcing multiple access control policies sushil jajodia, pierangela samarati, v. s. subrahmanian, eliza bertino 1997"
1831,253366,"revisiting commit processing in distributed database systems ramesh gupta, jayant haritsa, krithi ramamritham 1997"
1832,253338,"partitioned garbage collection of a large object store umesh maheshwari, barbara liskov 1997"
1833,253340,"size separation spatial join nick koudas, kenneth c. sevcik 1997"
1834,253342,"building a scaleable geo-spatial dbms: technology, implementation, and evaluation jignesh patel, jiebing yu, navin kabra, kristin tufte, biswadeep nag, josef burger, nancy hall, karthikeyan ramasamy, roger lueder, curt ellmann, jim kupsch, shelly guo, johan larson, david de witt, jeffrey naughton 1997"
1835,253344,"a toolkit for negotiation support interfaces to multi-dimensional data michael gebhardt, matthias jarke, stephan jacobs 1997"
1836,253345,"distance-based indexing for high-dimensional metric spaces tolga bozkaya, meral ozsoyoglu 1997"
1837,253347,"the sr-tree: an index structure for high-dimensional nearest neighbor queries norio katayama, shin'ichi satoh 1997"
1838,253349,"wave-indices: indexing evolving databases narayanan shivakumar, h&#233;ctor garc&#237;a-molina 1997"
1839,253352,"on-line warehouse view maintenance dallan quass, jennifer widom 1997"
1840,253395,"template-based wrappers in the tsimmis system joachim hammer, h&#233;ctor garc&#237;a-molina, svetlozar nestorov, ramana yerneni, marcus breunig, vasilis vassalos 1997"
1841,253393,"mdm: a multiple-data model tool for the management of heterogeneous database schemes paolo atzeni, riccardo torlone 1997"
1842,253389,"the context interchange mediator prototype s. bressan, c. h. goh, k. fynn, m. jakobisiak, k. hussein, h. kon, t. lee, s. madnick, t. pena, j. qu, a. shum, m. siegel 1997"
1843,253384,"semcog: an object-based image retrieval system and its visual query interface wen-syan li, k. sel&#231;uk candan, kyoji hirata, yoshinori hara 1997"
1844,253402,"the distributed information search component (disco) and the world wide web anthony tomasic, r&#233;my amouroux, philippe bonnet, olga kapitskaia, hubert naacke, louiqa raschid 1997"
1845,253401,"the infosleuth project r. j. bayardo, jr., w. bohrer, r. brice, a. cichocki, j. fowler, a. halal, v. kashyap, t. ksiezyk, g. martin, m. nodine, m. rashid, m. rusinkiewicz, r. shea, c. unnikrishnan, a. unruh, d. woelk 1997"
1846,253400,"infomaster: an information integration system michael r. genesereth, arthur m. keller, oliver m. duschka 1997"
1847,253397,"languages for multi-database interoperability fr&#233;d&#233;ric gingras, laks v. s. lakshmanan, iyer n. subramanian, despina papoulis, nematollaah shiri 1997"
1848,253373,"data warehousing and olap for decision support surajit chaudhuri, umeshwar dayal 1997"
1849,253372,databases on the web: technologies for federation architectures and case studies ralf kramer 1997
1850,253370,"object-relational database systems (tutorial): principles, products and challenges michael j. carey, nelson m. mattos, anil k. nori 1997"
1851,253368,"lessons from wall street: case studies in configuration, tuning, and distribution dennis shasha 1997"
1852,253379,"devise (demo abstract): integrated querying and visual exploration of large datasets m. livny, r. ramakrishnan, k. beyer, g. chen, d. donjerkovic, s. lawande, j. myllymaki, k. wenger 1997"
1853,253377,"picture programming project nita goyal, charles hoch, ravi krishnamurthy, brian meckler, michael suchow, moshe zloof 1997"
1854,253376,"delaunay: a database visualization system isabel f. cruz, m. averbuch, wendy t. lucas, melissa radzyminski, kirby zhang 1997"
1855,253374,query optimization at the crossroads surajit chaudhuri 1997
1856,261126,"disjunctive datalog thomas eiter, georg gottlob, heikki mannila 1997"
1857,261131,"probview: a flexible probabilistic database system laks v. s. lakshmanan, nicola leone, robert ross, v. s. subrahmanian 1997"
1858,253415,"zoo: a desktop experiment management environment yannis e. ioannidis, miron livny, anastassia ailamaki, anand narayanan, andrew therber 1997"
1859,261125,"transactional client-server cache consistency: alternatives and performance michael j. franklin, michael j. carey, miron livny 1997"
1860,262765,"ogdi: toward interoperability among geospatial databases gilles cl&#233;ment, christian larouche, denis gouin, paul morin, henry kucera 1997"
1861,262766,"an extended entity-relationship model for geographic applications thanasis hadzilacos, nectaria tryfona 1997"
1862,262763,"a query language for a web-site management system mary fernandez, daniela florescu, alon levy, dan suciu 1997"
1863,262764,"quasi-cubes: exploiting approximations in multidimensional databases daniel barbar&#225;, mark sullivan 1997"
1864,253405,"the whips prototype for data warehouse creation and maintenance wilburt j. labio, yue zhuge, janet l. wiener, himanshu gupta, h&#233;ctor garc&#237;a-molina, jennifer widom 1997"
1865,253406,"structural matching and discovery in document databases jason tsong-li wang, dennis shasha, george j. s. chang, liam relihan, kaizhong zhang, girish patel 1997"
