,id,info
638,615229,"themis: a database programming language handling integrity constraints v&#233;ronique benzaken, anne doucet 1995"
639,615228,"tigukat: a uniform behavioral objectbase management system m. tamer &#214;zsu, randal peters, duane szafron, boman irani, anna lipka, adriana mu&#241;oz 1995"
640,564697,"rate-based query optimization for streaming information sources stratis d. viglas, jeffrey f. naughton 2002"
641,564695,"an adaptive peer-to-peer network for distributed caching of olap results panos kalnis, wee siong ng, beng chin ooi, dimitris papadias, kian-lee tan 2002"
642,564694,"efficient integration and aggregation of historical information mirek riedewald, divyakant agrawal, amr el abbadi 2002"
643,564693,"archiving scientific data peter buneman, sanjeev khanna, keishi tajima, wang-chiew tan 2002"
644,564702,"efficient evaluation of queries in a mediator for websources vladimir zadorozhny, louiqa raschid, maria esther vidal, tolga urhan, laura bright 2002"
645,564701,"best-effort cache synchronization with source cooperation chris olston, jennifer widom 2002"
646,564699,"processing complex aggregate queries over data streams alin dobra, minos garofalakis, johannes gehrke, rajeev rastogi 2002"
647,564698,"continuously adaptive continuous queries over streams samuel madden, mehul shah, joseph m. hellerstein, vijayshankar raman 2002"
648,507365,reports avigdor gal 2002
649,507364,reminiscences on influential papers kenneth a. ross 2002
650,507363,influential papers ken ross 2002
651,507362,too much middleware michael stonebraker 2002
652,507369,why i like working in academia richard thomas snodgrass 2002
653,507368,career forum alexandros labrinidis 2002
654,507367,"advances in databases and information systems: report of 5th east european conference adbis'2001 albertas caplinskas, johann eder, olegas vasilecas 2002"
655,507366,"report on the 18th british national conference on databases (bncod) carole goble, brian read 2002"
656,507356,what will be michael dertouzos 2002
657,507357,distinguished database profiles marianne winslett 2002
658,507354,"databases and transaction processing: an application-oriented approach philip m. lewis, arthur bernstein, michael kifer 2002"
659,507355,"data mining: practical machine learning tools and techniques with java implementations ian h. witten, eibe frank 2002"
660,507360,the xml typechecking problem dan suciu 2002
661,507361,industry perspective len seligman 2002
662,507358,"avi silberschatz speaks out: on academia versus industrial labs, startup fever, database phd quality, the future of data mining as a research area, ip issues, how he wouldn't change a thing, and more marianne winslett 2002"
663,507359,database principles leonid libkin 2002
664,507348,"business data management for business-to-business electronic commerce christoph quix, mareike schoop, manfred jeusfeld 2002"
665,507349,"a multi-agent system infrastructure for software component market-place: an ontological perspective riza cenk erdur, o&#287;uz dikenelli 2002"
666,507346,conceptual modeling and specification generation for b2b business processes based on ebxml hyoungdo kim 2002
667,507347,"semantic b2b integration: issues in ontology-based approaches zhan cui, dean jones, paul o'brien 2002"
668,507352,book reviews karl aberer 2002
669,507353,book review column karl aberer 2002
670,507350,"supply chain infrastructures: system integration and information sharing michael o. ball, meng ma, louiqa raschid, zhengying zhao 2002"
671,507351,the role of b2b engines in b2b integration architectures christoph bussler 2002
672,564737,"clustering by pattern similarity in large data sets haixun wang, wei wang, jiong yang, philip s. yu 2002"
673,564735,"general match: a subsequence matching method in time-series databases based on generalized windows yang-sae moon, kyu-young whang, wook-shin han 2002"
674,564739,"a monte carlo algorithm for fast projective clustering cecilia m. procopiuc, michael jones, pankaj k. agarwal, t. m. murali 2002"
675,564738,"mining long sequential patterns in a noisy environment jiong yang, wei wang, philip s. yu, jiawei han 2002"
676,564742,"selectivity estimation for spatio-temporal queries to moving objects yong-jin choi, chin-wan chung 2002"
677,564741,"dynamic multidimensional histograms nitin thaper, sudipto guha, piotr indyk, nick koudas 2002"
678,564745,"dwarf: shrinking the petacube yannis sismanis, antonios deligiannakis, nick roussopoulos, yannis kotidis 2002"
679,564743,"hierarchical subspace sampling: a unified framework for high dimensional data reduction, selectivity estimation and nearest neighbor search charu c. aggarwal 2002"
680,564726,efficient algorithms for minimizing tree pattern queries prakash ramanan 2002
681,564725,"approximate xml joins sudipto guha, h. v. jagadish, nick koudas, divesh srivastava, ting yu 2002"
682,564729,"efficient k-nn search on vertically decomposed data arjen p. de vries, nikos mamoulis, niels nes, martin kersten 2002"
683,564727,"holistic twig joins: optimal xml pattern matching nicolas bruno, nick koudas, divesh srivastava 2002"
684,564731,"minimal probing: supporting expensive predicates for top-k queries kevin chen-chuan chang, seung-won hwang 2002"
685,564730,"time-parameterized queries in spatio-temporal databases yufei tao, dimitris papadias 2002"
686,564734,"continually evaluating similarity-based pattern queries on a streaming time series like gao, x. sean wang 2002"
687,564733,"statistical synopses for graph-structured xml databases neoklis polyzotis, minos garofalakis 2002"
688,564714,"qursed: querying and reporting semistructured data yannis papakonstantinou, michalis petropoulos, vasilis vassalos 2002"
689,564715,"storing and querying ordered xml using a relational database system igor tatarinov, stratis d. viglas, kevin beyer, jayavel shanmugasundaram, eugene shekita, chun zhang 2002"
690,564717,"executing sql over encrypted data in the database-service-provider model hakan hacig&#252;m&#252;&#351;, bala iyer, chen li, sharad mehrotra 2002"
691,564718,"workflow management with service quality guarantees michael gillmann, gerhard weikum, wolfgang wonner 2002"
692,564719,"mining database structure; or, how to build a data quality browser tamraparni dasu, theodore johnson, s. muthukrishnan, vladislav shkapenyuk 2002"
693,564721,"a scalable hash ripple join algorithm gang luo, curt j. ellmann, peter j. haas, jeffrey f. naughton 2002"
694,564722,"exploiting statistics on query expressions for optimization nicolas bruno, surajit chaudhuri 2002"
695,564723,"partial results for online query processing vijayshankar raman, joseph m. hellerstein 2002"
696,564703,"proxy-based acceleration of dynamically generated content on the world wide web: an approach and implementation anindya datta, kaushik dutta, helen thomas, debra vandermeer,  suresha, krithi ramamritham 2002"
697,564705,accelerating xpath location steps torsten grust 2002
698,564706,"apex: an adaptive path index for xml data chin-wan chung, jun-ki min, kyuseok shim 2002"
699,564707,"covering indexes for branching path queries raghav kaushik, philip bohannon, jeffrey f naughton, henry f korth 2002"
700,564709,"implementing database operations using simd instructions jingren zhou, kenneth a. ross 2002"
701,564710,"fractal prefetching b+-trees: optimizing both cache and disk performance shimin chen, phillip b. gibbons, todd c. mowry, gary valentin 2002"
702,564711,"skew handling techniques in sort-merge join wei li, dengfeng gao, richard thomas snodgrass 2002"
703,564713,"statix: making xml count juliana freire, jayant r. haritsa, maya ramanath, prasan roy, j&#233;r&#244;me sim&#233;on 2002"
704,564784,"hd-eye: visual clustering of high dimensional data alexander hinneburg, daniel a. keim, markus wawryniuk 2002"
705,564783,"gea: a toolkit for gene expression analysis jessica m. phan, raymond ng 2002"
706,564782,"dbxplorer: enabling keyword search over relational databases sanjay agrawal, surajit chaudhuri, gautam das 2002"
707,564781,"cubeexplorer: online exploration of data cubes jiawei han, jianyong wang, guozhu dong, jian pei, ke wang 2002"
708,564779,"xl: a platform for web services daniela florescu, andreas gr&#252;nhagen, donald kossmann, steffen rost 2002"
709,564778,"roadrunner: automatic data extraction from data-intensive web sites valter crescenzi, giansalvatore mecca, paolo merialdo 2002"
710,564777,"gigascope: high performance network monitoring with an sql interface chuck cranor, yuan gao, theodore johnson, vlaidslav shkapenyuk, oliver spatscheck 2002"
711,564776,"distributing queries over low-power wireless sensor networks samuel madden, joseph m. hellerstein 2002"
712,564775,"cougar: the network is the database wai fu fung, david sun, johannes gehrke 2002"
713,564774,"commix: towards effective web information extraction, integration and query answering tengjiao wang, shiwei tang, dongqing yang, jun gao, yuqing wu, jian pei 2002"
714,564773,"acdn: a content delivery network for applications pradnya karbhari, michael rabinovich, zhen xiao, fred douglis 2002"
715,564771,"xcache: a semantic caching system for xml queries li chen, elke a. rundensteiner, song wang 2002"
716,564770,"visual coko: a debugger for query optimizer development daniel j. abadi, mitch cherniack 2002"
717,564769,"toxgene: a template-based data generator for xml denilson barbosa, alberto mendelzon, john keenleyside, kelly lyons 2002"
718,564768,"the xxl search engine: ranked retrieval of xml data using indexes and ontologies anja theobald, gerhard weikum 2002"
719,564767,"rainbow: mapping-driven xquery processing system xin zhang, mukesh mulchandani, steffen christ, brian murphy, elke a. rundensteiner 2002"
720,564765,"dbcache: database caching for web application servers mehmet altinel, qiong luo, sailesh krishnamurthy, c. mohan, hamid pirahesh, bruce g. lindsay, honguk woo, larry brown 2002"
721,564766,"learning table access cardinalities with leo volker markl, guy lohman 2002"
722,564762,"web caching for database applications with oracle web cache jesse anton, lawrence jacobs, xiang liu, jordan parker, zheng zeng, tie zhong 2002"
723,564763,"middle-tier database caching for e-business qiong luo, sailesh krishnamurthy, c. mohan, hamid pirahesh, honguk woo, bruce g. lindsay, jeffrey f. naughton 2002"
724,564759,"tpc-ds, taking decision support benchmarking to the next level meikel poess, bryan smith, lubor kollar, paul larson 2002"
725,564761,mid-tier caching: the timesten approach  the timesten team 2002
726,564757,"automating physical database design in a parallel database jun rao, chun zhang, nimrod megiddo, guy lohman 2002"
727,564758,"the sdss skyserver: public access to the sloan digital sky server data alexander s. szalay, jim gray, ani r. thakar, peter z. kunszt, tanu malik, jordan raddick, christopher stoughton, jan vandenberg 2002"
728,564754,efficient execution of joins in a star schema andreas weininger 2002
729,564755,"quadtree and r-tree indexes in oracle spatial: a comparison using gis data ravi kanth v kothuri, siva ravada, daniel abugov 2002"
730,564751,"garlic: a new flavor of federated query processing for db2 vanja josifovski, peter schwarz, laura haas, eileen lin 2002"
731,564753,"a compact b-tree peter bumbulis, ivan t. bowman 2002"
732,564749,"coordinating backup/recovery and data consistency between database and file systems suparna bhattacharya, c. mohan, karen w. brannon, inderpal narang, hui-i hsiao, mahadevan subramanian 2002"
733,564750,"an ebxml infrastructure implementation through uddi registries and rosettanet pips asuman dogac, yusuf tambag, pinar pembecioglu, sait pektas, gokce laleci, gokhan kurt, serkan toprak, yildiray kabak 2002"
734,564746,"wavelet synopses with error guarantees minos garofalakis, phillip b. gibbons 2002"
735,564747,"compressing sql workloads surajit chaudhuri, ashish kumar gupta, vivek narasayya 2002"
736,565138,systems and prototypes jignesh patel 2002
737,565137,"a brief survey of web data extraction tools alberto h. f. laender, berthier a. ribeiro-neto, altigran s. da silva, juliana s. teixeira 2002"
738,565140,standards andrew eisenberg 2002
739,565139,"phoenix project: fault-tolerant applications roger barga, david lomet 2002"
740,565133,reports avigdor gal 2002
741,565132,data warehousing and business intelligence for e-commerce: by alan r. simon & steven l. shaffer frank g. goethals 2002
742,565135,report on the acm fourth international workshop on data warehousing and olap (dolap 2001) joachim hammer 2002
743,565134,"on building an infrastructure for mobile and wireless systems: report on the nsf workshop on an infrastructure for mobile and wireless systems, oct. 15, 2001 birgitta k&#246;nig-ries, kia makki, sam makki, charles perkins, niki pissinou, peter reiher, peter scheuermann, jari veijalainen, ouri wolfson 2002"
744,565129,book review column karl aberer 2002
745,565128,book reviews karl aberer 2002
746,565131,"mining the world wide web: an information search approach by george chang, marcus j. healey (editor), james a. m. mchugh, jason t. l. wang aris ouksel 2002"
747,565130,"data mining: concepts and techniques by jiawei han and micheline kamber fernando berzal, nicolf&#225;s mat&#237;n 2002"
748,565125,from ternary relationship to relational tables: a case against common beliefs rafael camps par&#233; 2002
749,565124,"cluster validity methods: part i maria halkidi, yannis batistakis, michalis vazirgiannis 2002"
750,565127,"david dewitt speaks out: on rethinking the cs curriculum, why the database community should be proud, why query optimization doesn't work, how supercomputing funding is sometimes very poorly spent, how he's not a good coder and isn't smart enough to do db theory, and more marianne winslett 2002"
751,565126,distinguished database profiles marianne winslett 2002
752,565120,"the design of a retrieval technique for high-dimensional data on tertiary storage ratko orlandic, jack lukaszuk, craig swietlik 2002"
753,565121,"a pictorial query language for querying geographic databases using positional and olap operators elaheh pourabbas, maurizio rafanelli 2002"
754,565122,investigating xquery for querying across database object types nancy wiegand 2002
755,565123,mpeg-7 and multimedia database systems harald kosch 2002
756,564799,"database tuning: principles, experiments, and troubleshooting techniques (part ii) dennis shasha, philippe bonnet 2002"
757,564801,software as a service: asp and asp aggregation christoph bussler 2002
758,565118,articles avigdor gal 2002
759,565119,"bringing order to query optimization giedrius slivinskas, christian s. jensen, richard thomas snodgrass 2002"
760,564792,implementing xquery paul cotton 2002
761,564794,"querying and mining data streams: you only get one look a tutorial minos garofalakis, johannes gehrke, rajeev rastogi 2002"
762,564796,tutorial: application servers and associated technologies c. mohan 2002
763,564798,"database tuning: principles, experiments, and troubleshooting techniques (part i) dennis shasha, philippe bonnet 2002"
764,564785,"xbase: making your gigabyte disk queriable hongjun lu, guoren wang, ge yu, yubin bao, jianhua lv, yaxin yu 2002"
765,564786,"xmdvtool: visual interactive data exploration and trend discovery of high-dimensional data sets elke a. rundensteiner, matthew o. ward, jing yang, punit r. doshi 2002"
766,564788,"data streams: fresh current or stagnant backwater? (panel) joseph m. hellerstein, jennifer widom 2002"
767,564790,going public: open-source databases and database research philippe bonnet 2002
768,671334,"algorithms for mining distance-based outliers in large datasets edwin m. knorr, raymond t. ng 1998"
769,671333,"information, communication, and money: for what can we charge and how can we meter it? stephen blott, henry f. korth, abraham silberschatz 1998"
770,671336,from data independence to knowledge independence: an on-going story laurent vieille 1998
771,671335,"materialized views in oracle randall g. bello, karl dias, alan downing, james j. feenan, jr., james l. finnerty, william d. norcott, harry sun, andrew witkowski, mohamed ziauddin 1998"
772,671338,"computing iceberg queries efficiently min fang, narayanan shivakumar, hector garcia-molina, rajeev motwani, jeffrey d. ullman 1998"
773,671337,"topaz: a cost-based, rule-driven, multi-phase parallelizer clara nippl, bernhard mitschang 1998"
774,671340,"scalable sweeping-based spatial join lars arge, octavian procopiuc, sridhar ramaswamy, torsten suel, jeffrey scott vitter 1998"
775,671339,"r-tree based indexing of now-relative bitemporal data rasa bliujute, christian s. jensen, simonas saltenis, giedrius slivinskas 1998"
776,671342,"wavecluster: a multi-resolution clustering approach for very large spatial databases gholamhosein sheikholeslami, surojit chatterjee, aidong zhang 1998"
777,671341,"evaluating functional joins along nested reference sets in object-relational and object-oriented databases reinhard braumandl, jens clau&#223;en, alfons kemper 1998"
778,671344,binding propagation in disjunctive databases sergio greco 1998
779,671343,atomicity versus anonymity: distributed transactions for electronic commerce j. d. tygar 1998
780,671346,"proximity search in databases roy goldman, narayanan shivakumar, suresh venkatasubramanian, hector garcia-molina 1998"
781,671345,"active storage for large-scale data mining and multimedia erik riedel, garth a. gibson, christos faloutsos 1998"
782,671349,"query optimization for xml jason mchugh, jennifer widom 1999"
783,671347,"aqua: a fast decision support systems using approximate query answers swarup acharya, phillip b. gibbons, viswanath poosala 1999"
784,671350,"building light-weight wrappers for legacy web data-sources using w4f arnaud sahuguet, fabien azavant 1999"
785,671351,performance measurements of compressed bitmap indices theodore johnson 1999
786,671352,"curio: a novel solution for efficient storage and indexing in data warehouses anindya datta, krithi ramamritham, helen m. thomas 1999"
787,671353,"the new locking, logging, and recovery architecture of microsoft sql server 7.0 david campbell 1999"
788,671354,"unrolling cycles to decide trigger termination sin yeung lee, tok wang ling 1999"
789,671355,"aggregation algorithms for very large compressed data warehouses jianzhong li, doron rotem, jaideep srivastava 1999"
790,671356,"quality-driven integration of heterogenous information systems felix naumann, ulf leser, johann christoph freytag 1999"
791,671357,"implementation of two semantic query optimization techniques in db2 universal database qi cheng, jarek gryz, fred koo, t. y. cliff leung, linqi liu, xiaoyan qian, k. bernhard schiefer 1999"
792,671358,high-performance extensible indexing marcel kornacker 1999
793,671359,"evaluating top-k selection queries surajit chaudhuri, luis gravano 1999"
794,671360,"building hierarchical classifiers using class proximity ke wang, senqiang zhou, shiang chen liew 1999"
795,671361,"voodb: a generic discrete-event random simulation model to evaluate the performances of oodbs j&#233;r&#244;me darmont, michel schneider 1999"
796,671362,"cache conscious indexing for decision-support in main memory jun rao, kenneth a. ross 1999"
797,671363,"an adaptive hybrid server architecture for client caching odbmss kaladhar voruganti, m. tamer &#214;zsu, ronald c. unrau 1999"
798,671364,"database architecture optimized for the new bottleneck: memory access peter a. boncz, stefan manegold, martin l. kersten 1999"
799,671365,"hierarchical prefix cubes for range-sum queries chee yong chan, yannis e. ioannidis 1999"
800,671494,"cost models do matter: providing cost information for diverse data sources in a federated system mary tork roth, fatma ozcan, laura m. haas 1999"
801,671493,"optimization of run-time management of data intensive web-sites daniela florescu, alon y. levy, dan suciu, khaled yagoub 1999"
802,671492,"issues in network management in the next millennium michael l. brodie, surajit chaudhuri 1999"
803,671491,"extending practical pre-aggregation in on-line analytical processing torben bach pedersen, christian s. jensen, curtis e. dyreson 1999"
804,671498,"context-based prefetch for implementing objects on relations philip a. bernstein, shankar pal, david shutt 1999"
805,671497,"xml repository and active views demonstration serge abiteboul, vincent aguilera, s&#233;bastien ailleret, bernd amann, sophie cluet, brendan hills, fr&#233;d&#233;ric hubert, jean-claude mamou, am&#233;lie marian, laurent mignet, tova milo, cassio souza dos santos, bruno tessier, anne-marie vercoustre 1999"
806,671496,"high level indexing of user-defined types weidong chen, jyh-herng chow, you-chin fuh, jean grandbois, michelle jou, nelson mendon&#231;a mattos, brian t. tran, yun wang 1999"
807,671495,"dynamic load balancing for parallel association rule mining on heterogenous pc cluster systems masahisa tamura, masaru kitsuregawa 1999"
808,671502,"industrial panel on data warehousing technologies: experiences, challenges, and directions umeshwar dayal 1999"
809,671501,"multi-dimensional substring selectivity estimation h. v. jagadish, olga kapitskaia, raymond t. ng, divesh srivastava 1999"
810,671500,explaining differences in multidimensional aggregates sunita sarawagi 1999
811,671499,"relational databases for querying xml documents: limitations and opportunities jayavel shanmugasundaram, kristin tufte, chun zhang, gang he, david j. dewitt, jeffrey f. naughton 1999"
812,671506,"generalised hash teams for join and group-by alfons kemper, donald kossmann, christian wiesner 1999"
813,671505,"optimal grid-clustering: towards breaking the curse of dimensionality in high-dimensional clustering alexander hinneburg, daniel a. keim 1999"
814,671504,"exploiting versions for handling updates in broadcast disks evaggelia pitoura, panos k. chrysanthis 1999"
815,671503,"pm3: an orthogonal persistent systems programming language - design, implementation, performance antony l. hosking, jiawan chen 1999"
816,671509,"a scalable and highly available networked database architecture roger bamford, rafiul ahad, angelo pruscino 1999"
817,671510,"probabilistic optimization of top n queries donko donjerkovic, raghu ramakrishnan 1999"
818,671507,"ghost: fine granularity buffering of indexes cheng hian goh, beng chin ooi, d. sim, kian-lee tan 1999"
819,671508,networked data management design points james r. hamilton 1999
820,671513,"spatio-temporal retrieval with rasdaman peter baumann, andreas dehmel, paula furtado, roland ritsch, norbert widmann 1999"
821,671514,"spirit: sequential pattern mining with regular expression constraints minos n. garofalakis, rajeev rastogi, kyuseok shim 1999"
822,671511,"on efficiently implementing schemasql on an sql database system laks v. s. lakshmanan, fereidoon sadri, subbu n. subramanian 1999"
823,671512,"extracting large-scale knowledge bases from the web ravi kumar, prabhakar raghavan, sridhar rajagopalan, andrew tomkins 1999"
824,671517,"a novel index supporting high volume data warehouse insertion chris jermaine, anindya datta, edward omiecinski 1999"
825,671518,"miro web: integrating multiple data sources through semistructured data types luc bouganim, tatiana chan-sine-ying, tuyet-tram dang-ngoc, jean-luc darroux, georges gardarin, fei sha 1999"
826,671515,"user-defined table operators: enhancing extensibility for ordbms michael jaedicke, bernhard mitschang 1999"
827,671516,"similarity search in high dimensions via hashing aristides gionis, piotr indyk, rajeev motwani 1999"
828,671521,"fast algorithms for maintaining replica consistency in lazy master replicated databases esther pacitti, pascale minet, eric simon 1999"
829,671522,"o-o, what have they done to db2? michael j. carey, donald d. chamberlin, srinivasa narayanan, bennet vance, doug doole, serge rielau, richard swagerman, nelson mendon&#231;a mattos 1999"
830,671519,"online feedback for nested aggregate queries with multi-threading kian-lee tan, cheng hian goh, beng chin ooi 1999"
831,671520,"implementation of sql3 structured types with inheritance and value substitutability you-chin fuh, stefan de&#223;loch, weidong chen, nelson mendon&#231;a mattos, brian t. tran, bruce g. lindsay, linda demichel, serge rielau, danko mannhaupt 1999"
832,671528,the value of merge-join and hash-join in sql server goetz graefe 1999
833,671527,"histogram-based approximation of set-valued query-answers yannis e. ioannidis, viswanath poosala 1999"
834,671530,"the mirror mmdbms architecture arjen p. de vries, mark g. l. m. van doorn, henk m. blanken, peter m. g. apers 1999"
835,671529,"finding intensional knowledge of distance-based outliers edwin m. knorr, raymond t. ng 1999"
836,671524,"data-driven, one-to-one web site generation for data-intensive applications stefano ceri, piero fraternali, stefano paraboschi 1999"
837,671523,"distributed hypertext resource discovery through examples soumen chakrabarti, martin van den berg, byron dom 1999"
838,671526,repeating history beyond aries c. mohan 1999
839,671525,"active storage hierarchy, database systems and applications - socratic exegesis felipe cari&#241;o, william o'connell, john burgess, joel h. saltz 1999"
840,671666,"what can hierarchies do for data warehouses? h. v. jagadish, laks v. s. lakshmanan, divesh srivastava 1999"
841,671665,"datawarehousing has more colours than just black &; white thomas zurek, markus sinnwell 1999"
842,671668,"combining histograms and parametric curve fitting for feedback-driven query result-size estimation arnd christian k&#246;nig, gerhard weikum 1999"
843,671667,"semantic compression and pattern extraction with fascicles h. v. jagadish, j. madar, raymond t. ng 1999"
