,id,info
732,conf/vldb/RezendeS98,"bridging heterogeneity: research and practice of database middleware technology günter sauter, fernando de ferreira rezende 1998"
733,conf/vldb/DeRose99,"what do those weird xml types want, anyway? steven j. derose 1999"
734,journals/sigmod/ChrysanthisSZ03,"report on the 4th international conference on mobile data management panos k. chrysanthis, arkady b. zaslavsky, morris sloman 2003"
735,conf/vldb/BrownG01,"a prototype content-based retrieval system that uses virtual images to save space leonard brown, le gruenwald 2001"
736,conf/vldb/BonifatiCDS01,"warehousing workflow data: challenges and opportunities umeshwar dayal, ming-chien shan, angela bonifati, fabio casati 2001"
737,conf/vldb/ChenRS95,"declustering databases on heterogeneous disk systems doron rotem, sridhar seshadri, ling tony chen 1995"
738,conf/vldb/DiaoLCT00,"toward learning based web query processing yanlei diao, hongjun lu, zengping tian, songting chen 2000"
739,journals/sigmod/YanG95,"information finding in a digital library: the stanford perspective tak w. yan, hector garcia-molina 1995"
740,journals/vldb/OoiTCH98,"fast image retrieval using color-spatial information kian-lee tan, tat-seng chua, beng chin ooi, wynne hsu 1998"
741,conf/sigmod/Brewer98,delivering high availability for inktomi search engines eric a. brewer 1998
742,conf/sigmod/MeccaAMMS98,"the araneus web-base management system giansalvatore mecca, paolo merialdo, alessandro masci, paolo atzeni, giuseppe sindoni 1998"
743,conf/sigmod/GuhaRS98,"cure: an efficient clustering algorithm for large databases sudipto guha, rajeev rastogi, kyuseok shim 1998"
744,conf/vldb/YangKL97,"algorithms for materialized view design in data warehousing environment kamalakar karlapalem, jian yang, qing li 1997"
745,conf/sigmod/ChakrabartiDI98,"enhanced hypertext categorization using hyperlinks byron dom, piotr indyk, soumen chakrabarti 1998"
746,conf/sigmod/QuassWGHLMNRRAUW96,"lore: a lightweight object repository for semistructured data janet l. wiener, jason mchugh, serge abiteboul, qingshan luo, anand rajaraman, dallan quass, jeffrey d. ullman, roy goldman, hugo rivero, jennifer widom, svetlozar nestorov, kevin haas 1996"
747,conf/sigmod/BabyCY01,"vqbd: exploring semistructured data jihwang yeo, sudarshan s. chawathe, thomas baby 2001"
748,journals/sigmod/GobleR02a,"the grid: an application of the semantic web carole a. goble, david de roure 2002"
749,conf/vldb/Leymann03,grid and applications (industrial session) frank leymann 2003
750,conf/sigmod/Sarawagi00,"i3: intelligent, interactive investigaton of olap data cubes sunita sarawagi, gayatri sathe 2000"
751,journals/sigmod/GriffinK98,"algebraic change propagation for semijoin and outerjoin queries timothy griffin, bharat kumar 1998"
752,journals/vldb/MirbelPSTV00,"checking the temporal integrity of interactive multimedia documents s. tserkezoglou, timos k. sellis, barbara pernici, michalis vazirgiannis, isabelle mirbel 2000"
753,journals/vldb/ChanFGR02,"efficient filtering of xml documents with xpath expressions rajeev rastogi, pascal felber, chee yong chan, minos n. garofalakis 2002"
754,conf/sigmod/GarofalakisRRS99,"of crawlers, portals, mice and men: is there more to mining the web? (panel) kyuseok shim, rajeev rastogi, minos n. garofalakis, sridhar ramaswamy 1999"
755,journals/sigmod/DoanPK95,"design and user testing of a multi-paradigm query interface to an object-oriented database dac khoa doan, alistair c. kilgour, norman w. paton 1995"
756,journals/tods/Chomicki95,efficient checking of temporal integrity constraints using bounded history encoding jan chomicki 1995
757,conf/vldb/HinneburgAK00,"what is the nearest neighbor in high dimensional spaces? charu c. aggarwal, alexander hinneburg, daniel a. keim 2000"
758,conf/sigmod/DarEGP98,"dtl's dataspot: database exploration as easy as browsing the web gadi entin, shai geva, eran palmon, shaul dar 1998"
759,journals/sigmod/CoxEH96,"3d geographic network displays taosong he, stephen g. eick, kenneth c. cox 1996"
760,conf/vldb/CeriFP99,"data-driven, one-to-one web site generation for data-intensive applications stefano paraboschi, piero fraternali, stefano ceri 1999"
761,conf/vldb/KarayannidisTSPMRFEB02,"processing star queries on hierarchically-clustered fact tables nikos karayannidis, frank ramsak, timos k. sellis, rudolf bayer, robert fenk, klaus elhardt, volker markl, roland pieringer, aris tsois 2002"
762,conf/sigmod/SchleimerWA03,"winnowing: local algorithms for document fingerprinting alexander aiken, daniel shawcross wilkerson, saul schleimer 2003"
763,journals/vldb/HarderR96,"access path support for referential integrity in sql2 joachim reinert, theo härder 1996"
764,journals/sigmod/CheungF98,"enhanced nearest neighbour search on the r-tree ada wai-chee fu, king lum cheung 1998"
765,conf/sigmod/BilirisP94,"eos: an extensible object store euthimios panagos, alexandros biliris 1994"
766,conf/vldb/LakshmananSS96,"schemasql - a language for interoperability in relational multi-database systems fereidoon sadri, laks v. s. lakshmanan, iyer n. subramanian 1996"
767,conf/sigmod/DoanDH01,"reconciling schemas of disparate data sources: a machine-learning approach anhai doan, pedro domingos, alon y. halevy 2001"
768,journals/vldb/NgS98,"optimal clip ordering for multi-clip queries raymond t. ng, paul shum 1998"
769,conf/vldb/CasatiS00,"process automation as the foundation for e-business fabio casati, ming-chien shan 2000"
770,journals/sigmod/Widom94,research issues in active database systems: report from the closing panel at ride-ads '94 jennifer widom 1994
771,journals/sigmod/Snodgrass03,acm tods in this internet age richard t. snodgrass 2003
772,conf/vldb/PapadiasMD98,"algorithms for querying by spatial structure nikos mamoulis, dimitris papadias, vasilis delis 1998"
773,conf/sigmod/CatarciS94,"query by diagram: a graphical environment for querying databases giuseppe santucci, tiziana catarci 1994"
774,conf/vldb/JaedickeM99,"user-defined table operators: enhancing extensibility for ordbms bernhard mitschang, michael jaedicke 1999"
775,journals/sigmod/Dogac02,guest editor's introduction asuman dogac 2002
776,conf/sigmod/GuoSBS03,"xrank: ranked keyword search over xml documents feng shao, lin guo, chavdar botev, jayavel shanmugasundaram 2003"
777,journals/sigmod/Snodgrass98c,chair's message richard t. snodgrass 1998
778,journals/sigmod/NestorovAM97,"infering structure in semistructured data rajeev motwani, serge abiteboul, svetlozar nestorov 1997"
779,conf/vldb/LakshmananPZ03,"efficacious data cube exploration by semantic summarization and compression jian pei, laks v. s. lakshmanan, yan zhao 2003"
780,conf/sigmod/Arpaci-DusseauACHP97,"high-performance sorting on networks of workstations david e. culler, joseph m. hellerstein, david a. patterson, andrea c. arpaci-dusseau, remzi h. arpaci-dusseau 1997"
781,journals/sigmod/Scholl01,transactional information systems - book review marc h. scholl 2001
782,journals/tods/BunemanO96,"polymorphism and type inference in database programming atsushi ohori, peter buneman 1996"
783,conf/vldb/BarjaPFWD94,"an effective deductive object-oriented database through language integration m. howard williams, norman w. paton, andrew dinn, maria l. barja, alvaro a. a. fernandes 1994"
784,conf/vldb/RaoR99,"cache conscious indexing for decision-support in main memory kenneth a. ross, jun rao 1999"
785,conf/vldb/AmirKN01,"analyzing quantitative databases: image is everything reuven kashi, nathan s. netanyahu, amihood amir 2001"
786,conf/sigmod/AltinelLKMPLWB02,"dbcache: database caching for web application servers sailesh krishnamurthy, c. mohan, larry brown, hamid pirahesh, mehmet altinel, honguk woo, qiong luo, bruce g. lindsay 2002"
787,journals/tods/KossmannS00,"iterative dynamic programming: a new class of query optimization algorithms donald kossmann, konrad stocker 2000"
788,conf/vldb/KornackerB95,"high-concurrency locking in r-trees douglas banks, marcel kornacker 1995"
789,conf/sigmod/AdamY98,"electronic commerce: tutorial nabil r. adam, yelena yesha 1998"
790,journals/vldb/JiangE98,"spatial and temporal content-based access to hypervideo databases ahmed k. elmagarmid, haitao jiang 1998"
791,conf/vldb/AlonsoHST97,"distributed processing over stand-alone systems and applications claus hagen, hans-jörg schek, gustavo alonso, markus tresch 1997"
792,conf/sigmod/ChoG00,"synchronizing a database to improve freshness junghoo cho, hector garcia-molina 2000"
793,conf/vldb/Korth95,the double life of the transaction abstraction: fundamental principle and evolving system concept henry f. korth 1995
794,conf/sigmod/PalmerF00,"density biased sampling: an improved method for data mining and clustering christopher r. palmer, christos faloutsos 2000"
795,journals/sigmod/X94,the tsql2 final language definition announcement ? 1994
796,conf/vldb/TanEO01,"efficient progressive skyline computation pin-kwang eng, kian-lee tan, beng chin ooi 2001"
797,journals/sigmod/Kosch02,mpeg-7 and multimedia database systems harald kosch 2002
798,conf/vldb/AgrawalSX01,"storage and querying of e-commerce data yirong xu, rakesh agrawal, amit somani 2001"
799,conf/sigmod/KotidisR99,"dynamat: a dynamic view management system for data warehouses nick roussopoulos, yannis kotidis 1999"
800,conf/vldb/GilbertKMS02,"how to summarize the universe: dynamic maintenance of quantiles martin strauss, s. muthukrishnan, yannis kotidis, anna c. gilbert 2002"
801,journals/sigmod/Grohe02,parameterized complexity for the database theorist martin grohe 2002
802,journals/sigmod/Franklin00b,editor's notes michael j. franklin 2000
803,conf/sigmod/Bierman03,formal semantics and analysis of object queries gavin m. bierman 2003
804,conf/sigmod/DogacAEOADAOS94,"metu object-oriented dbms cetin ozkan, cem evrendilek, yuksel saygin, ilker altintas, ismailcem budak arpinar, mehmet altinel, tansel okay, ilker durusoy, asuman dogac 1994"
805,journals/vldb/AtkinsonM95,"orthogonally persistent object systems malcolm p. atkinson, ronald morrison 1995"
806,conf/vldb/SkubiszewskiV97,"concurrent garbage collection in o2 marcin skubiszewski, patrick valduriez 1997"
807,conf/vldb/CeriM03,"constructing and integrating data-centric web applications: methods, tools, and techniques ioana manolescu, stefano ceri 2003"
808,journals/sigmod/MeersmanS02,"guest editor's introduction robert meersman, amit p. sheth 2002"
809,conf/vldb/DarEGP98,"dtl's dataspot: database exploration using plain language gadi entin, shai geva, shaul dar, eran palmon 1998"
810,journals/sigmod/Franklin98,editor's notes michael j. franklin 1998
811,conf/vldb/CabreraRH95,"applying database technology in the adsm mass storage system robert rees, luis-felipe cabrera, wayne hineman 1995"
812,conf/sigmod/LeeWMS01,"dynamic buffer allocation in video-on-demand systems kyu-young whang, yang-sae moon, il-yeol song, sang ho lee 2001"
813,conf/vldb/JiangWL03,"holistic twig joins on indexed xml documents wei wang, haifeng jiang, hongjun lu, jeffrey xu yu 2003"
814,conf/vldb/Levy96,obtaining complete answers from incomplete databases alon y. levy 1996
815,conf/vldb/StaudtJ96,"incremental maintenance of externally materialized views martin staudt, matthias jarke 1996"
816,journals/sigmod/MedeirosP94,"databases for gis claudia bauzer medeiros, fatima pires 1994"
817,conf/sigmod/FlorescuLMS99,"query optimization in the presence of limited access patterns dan suciu, ioana manolescu, daniela florescu, alon y. levy 1999"
818,conf/sigmod/ParkCY95,"an effective hash based algorithm for mining association rules ming-syan chen, philip s. yu, jong soo park 1995"
819,conf/vldb/VieiraM03,"a dependability benchmark for oltp application environments henrique madeira, marco vieira 2003"
820,conf/sigmod/Lomet00,high speed on-line backup when using logical log operations david b. lomet 2000
821,journals/sigmod/Han98,towards on-line analytical mining in large databases jiawei han 1998
822,conf/vldb/LiCHH97,"facilitating multimedia database exploration through visual interfaces and perpetual query reformulations kyoji hirata, yoshinori hara, wen-syan li, k. selçuk candan 1997"
823,journals/vldb/DerrMP94,"the glue-nail deductive database system: design, implementation, and evaluation geoffrey phipps, marcia a. derr, shinichi morishita 1994"
824,conf/sigmod/RoussopoulosKR97,"cubetree: organization of and bulk updates on the data cube nick roussopoulos, mema roussopoulos, yannis kotidis 1997"
825,journals/sigmod/Winslett02,interview with avi silberschatz marianne winslett 2002
826,journals/sigmod/WinslettCDHZZ02,"database research at the university of illinois at urbana-champaign chengxiang zhai, marianne winslett, yuanyuan zhou, kevin chen-chuan chang, jiawei han, anhai doan 2002"
827,conf/sigmod/ReinwaldP98,"sql open heterogeneous data access berthold reinwald, hamid pirahesh 1998"
828,journals/sigmod/GobleR02,"report on the 18th british national conference on databases (bncod) carole a. goble, brian j. read 2002"
829,conf/vldb/ShuklaDN98,"materialized view selection for multidimensional datasets jeffrey f. naughton, amit shukla, prasad deshpande 1998"
830,journals/vldb/CombiP01,"hmap - a temporal data model managing intervals with different granularities and indeterminacy from natural language sentences carlo combi, giuseppe pozzi 2001"
831,conf/vldb/NipplM98,"topaz: a cost-based, rule-driven, multi-phase parallelizer bernhard mitschang, clara nippl 1998"
832,conf/vldb/SadriZZA01,"a sequential pattern query language for supporting instant data mining for e-services reza sadri, amir m. zarkesh, jafar adibi, carlo zaniolo 2001"
833,conf/vldb/HinneburgLH03,"combi-operator: database support for data mining applications wolfgang lehner, alexander hinneburg, dirk habich 2003"
834,conf/vldb/DeckerK03,"the semantic web: semantics for data on the web vipul kashyap, stefan decker 2003"
835,journals/sigmod/AlonsoCIM95,"managing video data in a mobile environment rafael alonso, yuh-lin chang, v. s. mani, liviu iftode 1995"
836,conf/vldb/GarofalakisI97,"parallel query scheduling and optimization with time- and space-shared resources yannis e. ioannidis, minos n. garofalakis 1997"
837,conf/sigmod/Freeston95,a general solution of the n-dimensional b-tree problem michael freeston 1995
838,conf/sigmod/Gray95,parallel database systems 101 jim gray 1995
839,conf/vldb/GeorgeH98,"secure buffering in firm real-time database systems binto george, jayant r. haritsa 1998"
840,journals/sigmod/KoksalAD98,"workflow history management pinar koksal, sena nural arpinar, asuman dogac 1998"
841,conf/sigmod/AcharyaAFZ95,"broadcast disks: data management for asymmetric communications environments michael j. franklin, stanley b. zdonik, swarup acharya, rafael alonso 1995"
842,conf/vldb/CormodeDIM02,"comparing data streams using hamming norms (how to zero in) mayur datar, piotr indyk, s. muthukrishnan, graham cormode 2002"
843,conf/vldb/SakuraiYUK00,"the a-tree: an index structure for high-dimensional spaces using relative approximation masatoshi yoshikawa, shunsuke uemura, yasushi sakurai, haruhiko kojima 2000"
844,conf/vldb/BliujuteJSS98,"r-tree based indexing of now-relative bitemporal data simonas saltenis, christian s. jensen, giedrius slivinskas, rasa bliujute 1998"
845,conf/sigmod/LiGS02,"skew handling techniques in sort-merge join richard t. snodgrass, wei li, dengfeng gao 2002"
846,conf/sigmod/PonnekantiK00,"online index rebuild hanuma kodavalla, nagavamsi ponnekanti 2000"
847,journals/vldb/NanopoulosM02,"efficient similarity search for market basket data alexandros nanopoulos, yannis manolopoulos 2002"
848,conf/vldb/YuSLJ02,"compressed accessibility map: efficient access control for xml divesh srivastava, ting yu, h. v. jagadish, laks v. s. lakshmanan 2002"
849,conf/sigmod/BarbosaMKL02,"toxgene: a template-based data generator for xml alberto o. mendelzon, john keenleyside, denilson barbosa, kelly a. lyons 2002"
850,journals/sigmod/LuoI02,"interviewing during a tight job market zachary g. ives, qiong luo 2002"
851,conf/vldb/XinHLW03,"star-cubing: computing iceberg cubes by top-down and bottom-up integration jiawei han, xiaolei li, benjamin w. wah, dong xin 2003"
852,conf/vldb/ZurekS99,"datawarehousing has more colours than just black & white thomas zurek, markus sinnwell 1999"
853,journals/vldb/GeorgakopoulosRL94,"chronological scheduling of transactions with temporal dependencies marek rusinkiewicz, dimitrios georgakopoulos, witold litwin 1994"
854,journals/vldb/FahlR97,"query processing over object views of relational data gustav fahl, tore risch 1997"
855,journals/vldb/ChidlovskiiB00,"semantic caching of web queries boris chidlovskii, uwe m. borghoff 2000"
856,conf/vldb/DyresonBJ99,"capturing and querying multiple aspects of semistructured data curtis e. dyreson, michael h. böhlen, christian s. jensen 1999"
857,conf/vldb/BunkerCCMMW01,"aggregate maintenance for data warehousing in informix red brick vista latha s. colby, gopal mulagund, richard l. cole, craig j. bunker, william j. mckenna, david wilhite 2001"
858,conf/vldb/ShethKMWDLPLS96,"supporting state-wide immunisation tracking using multi-paradigm workflow technology devashish worah, souvik das, ivan shevchenko, amit p. sheth, john a. miller, chenye lin, devanand palaniswami, krys kochut, john lynch 1996"
859,conf/sigmod/AbadiC02,"visual coko: a debugger for query optimizer development daniel j. abadi, mitch cherniack 2002"
860,conf/vldb/PossP03,"data compression in oracle meikel pöss, dmitry potapov 2003"
861,conf/vldb/CochinwalaB94,"a multidatabase system for tracking and retrieval of financial data munir cochinwala, john bradley 1994"
862,conf/sigmod/LabioYG99,"shrinking the warehouse update window hector garcia-molina, ramana yerneni, wilburt labio 1999"
863,conf/vldb/SavasereON95,"an efficient algorithm for mining association rules in large databases edward omiecinski, shamkant b. navathe, ashok savasere 1995"
864,journals/vldb/PacittiS00,"update propagation strategies to improve freshness in lazy master replicated databases eric simon, esther pacitti 2000"
865,journals/tods/YanG99,"the sift information dissemination system tak w. yan, hector garcia-molina 1999"
866,journals/sigmod/Barbara01,special issue on data mining for intrusion detection and threat analysis - guest editor's introduction daniel barbará 2001
867,conf/sigmod/Raghavan03,extracting and exploiting structure in text search prabhakar raghavan 2003
868,conf/sigmod/SengarH03,"plastic: reducing query optimization overheads through plan recycling jayant r. haritsa, vibhuti s. sengar 2003"
869,conf/sigmod/GarofalakisG02,"wavelet synopses with error guarantees phillip b. gibbons, minos n. garofalakis 2002"
870,conf/sigmod/AfratiLU01,"generating efficient plans for queries using views chen li, jeffrey d. ullman, foto n. afrati 2001"
871,conf/sigmod/LakshmananPZ03,"qc-trees: an efficient summary structure for semantic olap laks v. s. lakshmanan, jian pei, yan zhao 2003"
872,conf/vldb/PatonG01,"information management for genome level bioinformatics norman w. paton, carole a. goble 2001"
873,conf/vldb/AltinelF00,"efficient filtering of xml documents for selective dissemination of information michael j. franklin, mehmet altinel 2000"
874,journals/tods/KrishnakumarB94,"bounded ignorance: a technique for increasing concurrency in a replicated system arthur j. bernstein, narayanan krishnakumar 1994"
875,journals/sigmod/Segev94b,editor's notes and erratum arie segev 1994
876,conf/sigmod/Edelstein95,research and products: are they relevant to each other? (panel) herb edelstein 1995
877,journals/sigmod/CareyS99,"nsf workshop on industrial/academic cooperation in database systems leonard j. seligman, michael j. carey 1999"
878,conf/vldb/CatozziR01,"operating system extensions for the teradata parallel vldb sorana rabinovici, john catozzi 2001"
879,conf/vldb/YangLH03,"efficient mining of xml query patterns for caching liang huai yang, mong-li lee, wynne hsu 2003"
880,conf/sigmod/GoyalHKMS96,"is gui programming a database research problem? ravi krishnamurthy, charles hoch, nita goyal, michael suckow, brian meckler 1996"
881,journals/sigmod/Critchlow01,report on xewa-00: the xml enabled wide-area searches for bioinformatics workshop terence critchlow 2001
882,conf/vldb/Fox02,toward recovery-oriented computing armando fox 2002
883,conf/vldb/AshwinGG02,"adaptable similarity search using non-relevant information t. v. ashwin, rahul gupta, sugata ghosal 2002"
884,conf/vldb/LaneEN00,"biodiversity informatics: the challenge of rapid development, large databases, and complex data (keynote) james l. edwards, meridith a. lane, ebbe nielsen 2000"
885,journals/sigmod/TsotrasK96,"temporal database bibliography update anil kumar, vassilis j. tsotras 1996"
886,journals/sigmod/AtkinsonDJPS96,"an orthogonally persistent java mick j. jordan, susan spence, laurent daynès, malcolm p. atkinson, tony printezis 1996"
887,conf/sigmod/LakshmananPZ03a,"socqet: semantic olap with compressed cube and summarization yan zhao, laks v. s. lakshmanan, jian pei 2003"
888,conf/sigmod/GotoK03,"integration of electronic tickets and personal guide system for public transport using mobile terminals yahiko kambayashi, koichi goto 2003"
889,journals/tods/Ross96,tail recursion elimination in deductive databases kenneth a. ross 1996
890,conf/vldb/PantiSG00,"a case-based approach to information integration maurizio panti, alberto giretti, luca spalazzi 2000"
891,journals/sigmod/RamDD99,"distributed transactions in practice lyman do, pamela drew, prabhu ram 1999"
892,conf/vldb/GardarinST96,"calibrating the query optimizer cost model of iro-db, an object-oriented federated database system zhao-hui tang, fei sha, georges gardarin 1996"
893,journals/sigmod/BertinoEH01,"quality of service in multimedia digital libraries elisa bertino, ahmed k. elmagarmid, mohand-said hacid 2001"
894,journals/sigmod/BiancheriPP01,"eiha?!?: deploying web and wap services using xml technology jean-christophe r. pazzaglia, chiara biancheri, gavino paddeu 2001"
895,conf/sigmod/AcharyaGPR99a,"join synopses for approximate query answering swarup acharya, viswanath poosala, phillip b. gibbons, sridhar ramaswamy 1999"
896,conf/vldb/ChakrabartiBD99,"distributed hypertext resource discovery through examples martin van den berg, soumen chakrabarti, byron dom 1999"
897,conf/sigmod/Colliat03,data management challenges in crm george colliat 2003
898,journals/sigmod/EisenbergM00,"sql standardization: the next steps andrew eisenberg, jim melton 2000"
899,conf/sigmod/LivnyRBCDLMW97,"devise: integrated querying and visualization of large datasets miron livny, raghu ramakrishnan, donko donjerkovic, shilpa lawande, jussi myllymaki, guangshun chen, r. kent wenger, kevin s. beyer 1997"
900,conf/vldb/ShuklaDNR96,"storage estimation for multidimensional aggregates in the presence of hierarchies jeffrey f. naughton, amit shukla, karthikeyan ramasamy, prasad deshpande 1996"
901,conf/sigmod/PapadiasTFS03,"an optimal and progressive algorithm for skyline queries bernhard seeger, dimitris papadias, greg fu, yufei tao 2003"
902,journals/sigmod/SureSS02,"methodology for development and employment of ontology based knowledge management applications steffen staab, rudi studer, york sure 2002"
903,conf/sigmod/DobraGGR02,"processing complex aggregate queries over data streams alin dobra, johannes gehrke, rajeev rastogi, minos n. garofalakis 2002"
904,conf/vldb/Cabrera03,web services (industrial session) felipe cabrera 2003
905,conf/sigmod/TsurUACMNR98,"query flocks: a generalization of association-rule mining chris clifton, svetlozar nestorov, rajeev motwani, shalom tsur, jeffrey d. ullman, arnon rosenthal, serge abiteboul 1998"
906,conf/vldb/LifantsevC02,"i/o-conscious data preparation for large-scale web search engines maxim lifantsev, tzi-cker chiueh 2002"
907,journals/sigmod/Snodgrass99b,reminiscences on influential papers richard t. snodgrass 1999
908,conf/sigmod/ChenWZ98,"a protein patent query system powered by kleisli jing chen, louxin zhang, limsoon wong 1998"
909,journals/sigmod/SilberschatzZ97,"database systems - breaking out of the box abraham silberschatz, stanley b. zdonik 1997"
910,conf/vldb/Meier95,providing database migration tools - a practicioner's approach andreas meier 1995
911,journals/tods/ChrysanthisR94,"synthesis of extended transaction models using acta panos k. chrysanthis, krithi ramamritham 1994"
912,conf/sigmod/KornackerSH98,"amdb: an access method debugging tool joseph m. hellerstein, mehul a. shah, marcel kornacker 1998"
913,conf/vldb/JoshiBLL98,"checkpointing in oracle juan loaiza, ashok joshi, tirthankar lahiri, william bridge 1998"
914,journals/vldb/C95c,"title, foreword, vldb journal to be published electronically, index vol. 4 ? 1995"
915,journals/sigmod/GatziuJSV99,"design and management of data warehouses: report on the dmdw'99 workshop martin staudt, yannis vassiliou, manfred a. jeusfeld, stella gatziu 1999"
916,conf/sigmod/AgrawalES03,"information sharing across private databases ramakrishnan srikant, rakesh agrawal, alexandre v. evfimievski 2003"
917,conf/sigmod/ShatdalN95,"adaptive parallel aggregation algorithms jeffrey f. naughton, ambuj shatdal 1995"
918,conf/sigmod/KanthRSB99,"indexing medium-dimensionality data in oracle jayant sharma, kothuri venkata ravi kanth, jay banerjee, siva ravada 1999"
919,conf/sigmod/ZhugeGHW95,"view maintenance in a warehousing environment jennifer widom, hector garcia-molina, yue zhuge, joachim hammer 1995"
920,journals/sigmod/Snodgrass99,chair's message richard t. snodgrass 1999
921,conf/sigmod/OriaOILY00,"disima: a distributed and interoperable image database system vincent oria, benjamin bin yao, shu lin, paul iglinski, m. tamer özsu 2000"
