,id,info
0,journals/sigmod/Mackay99,semantic integration of environmental models for application to global information systems and decision-making d. scott mackay 1999
1,conf/vldb/PoosalaI96,"estimation of query-result distribution and its application in parallel-join load balancing viswanath poosala, yannis e. ioannidis 1996"
2,conf/vldb/PalpanasSCP02,"incremental maintenance for non-distributive aggregate functions themistoklis palpanas, richard sidle, hamid pirahesh, roberta cochrane 2002"
3,conf/vldb/GardarinGT96,"cost-based selection of path expression processing algorithms in object-oriented databases zhao-hui tang, georges gardarin, jean-robert gruser 1996"
4,conf/vldb/HoelS95,"benchmarking spatial join operations with spatial output erik g. hoel, hanan samet 1995"
5,conf/sigmod/Keim99,efficient geometry-based similarity search of 3d spatial databases daniel a. keim 1999
6,journals/sigmod/Ouksel02,mining the world wide web: an information search approach - book review aris m. ouksel 2002
7,journals/vldb/Seshadri98,enhanced abstract data types in object-relational databases praveen seshadri 1998
8,journals/sigmod/RamamrithamS97,"report on dart '96: databases: active and real-time (concepts meet practice) nandit soparkar, krithi ramamritham 1997"
9,journals/sigmod/DAndreaJ96,"unisql's next-generation object-relational database management system phil janus, albert d'andrea 1996"
10,conf/vldb/KemperK94,"dual-buffering strategies in object bases alfons kemper, donald kossmann 1994"
11,conf/sigmod/AbadiCCCCEGHMRSSTXYZ03,"aurora: a data stream management system nesime tatbul, daniel j. abadi, c. erwin, anurag maskey, mitch cherniack, alex rasin, christian convey, a. singer, eduardo f. galvez, r. yan, ugur çetintemel, ying xing, stanley b. zdonik, michael stonebraker, donald carney, m. hatoun 2003"
12,journals/vldb/SivasankaranSTPR96,"priority assignment in real-time active databases rajendran m. sivasankaran, bhaskar purimetla, john a. stankovic, krithi ramamritham, donald f. towsley 1996"
13,journals/vldb/SheikholeslamiCZ00,"wavecluster: a wavelet based clustering approach for spatial data in very large databases surojit chatterjee, gholamhosein sheikholeslami, aidong zhang 2000"
14,journals/vldb/ChangG01,"approximate query mapping: accounting for translation closeness hector garcia-molina, kevin chen-chuan chang 2001"
15,conf/vldb/ShaferAM96,"sprint: a scalable parallel classifier for data mining john c. shafer, rakesh agrawal, manish mehta 1996"
16,conf/sigmod/AgichteinGV01,"snowball: a prototype system for extracting relations from large text collections jeff pavel, luis gravano, aleksandr voskoboynik, eugene agichtein, viktoriya sokolova 2001"
17,conf/sigmod/GriffinH97,"a framework for implementing hypothetical queries timothy griffin, richard hull 1997"
18,journals/vldb/IoannidisNSS97,"parametric query optimization raymond t. ng, timos k. sellis, yannis e. ioannidis, kyuseok shim 1997"
19,conf/vldb/CuiW01,"lineage tracing for general data warehouse transformations yingwei cui, jennifer widom 2001"
20,journals/sigmod/Hammer02,report on the acm fourth international workshop on data warehousing and olap (dolap 2001) joachim hammer 2002
21,conf/vldb/Bar-YossefBCFW00,"approximating aggregate queries about web pages via random walks jittat fakcharoenphol, steve chien, ziv bar-yossef, alexander berg, dror weitz 2000"
22,journals/sigmod/FernandezFLS97,"a query language for a web-site management system dan suciu, daniela florescu, alon y. levy, mary f. fernandez 1997"
23,conf/vldb/BertinoBFS96,"supporting periodic authorizations and temporal reasoning in database access control elena ferrari, pierangela samarati, claudio bettini, elisa bertino 1996"
24,conf/sigmod/LiS98,"free parallel data mining bin li, dennis shasha 1998"
25,conf/vldb/ChenCFGJMTW99,"high level indexing of user-defined types brian t. tran, jyh-herng chow, michelle jou, jean grandbois, yun wang, you-chin fuh, weidong chen, nelson mendonça mattos 1999"
26,conf/vldb/Bernstein94,pc database systems - present and future philip a. bernstein 1994
27,conf/vldb/LuoN01,"form-based proxy caching for database-backed web sites jeffrey f. naughton, qiong luo 2001"
28,journals/vldb/AbiteboulCM98,"a logical view of structured files tova milo, serge abiteboul, sophie cluet 1998"
29,journals/sigmod/PitouraAPSV03,"dbglobe: a service-oriented p2p system for global computing evaggelia pitoura, serge abiteboul, michalis vazirgiannis, dieter pfoser, george samaras 2003"
30,conf/sigmod/BraumandlKK99,"database patchwork on the internet reinhard braumandl, alfons kemper, donald kossmann 1999"
31,conf/vldb/ZemankovaI94,"scientific databases - state of the art and future directions yannis e. ioannidis, maria zemankova 1994"
32,conf/vldb/BerckenSW97,"a generic approach to bulk loading multidimensional index structures bernhard seeger, peter widmayer, jochen van den bercken 1997"
33,conf/vldb/ZhouS03,"data bubbles for non-vector data: speeding-up hierarchical clustering in arbitrary metric spaces jörg sander, jianjun zhou 2003"
34,conf/vldb/LabioG96,"efficient snapshot differential algorithms for data warehousing hector garcia-molina, wilburt labio 1996"
35,conf/vldb/CochranePM96,"integrating triggers and declarative constraints in sql database sytems roberta cochrane, hamid pirahesh, nelson mendonça mattos 1996"
36,conf/vldb/HristidisGP03,"efficient ir-style keyword search over relational databases yannis papakonstantinou, luis gravano, vagelis hristidis 2003"
37,journals/vldb/SaltenisJ02,"indexing of now-relative spatio-bitemporal data simonas saltenis, christian s. jensen 2002"
38,conf/sigmod/Dyreson03,"temporal coalescing with now, granularity, and incomplete information curtis e. dyreson 2003"
39,journals/sigmod/ChakravarthyAEFO03,"database research at ut arlington sharma chakravarthy, y. alp aslandogan, ramez elmasri, leonidas fegaras, jung-hwan oh 2003"
40,journals/sigmod/KimballS95,"why decision support fails and how to fix it kevin strehlo, ralph kimball 1995"
41,conf/vldb/OzdenBRS94,"a low-cost storage server for movie on demand databases alexandros biliris, banu özden, abraham silberschatz, rajeev rastogi 1994"
42,conf/vldb/NinkHR99,"generating call-level interfaces for advanced database application programming theo härder, norbert ritter, udo nink 1999"
43,conf/sigmod/WangWYY02,"clustering by pattern similarity in large data sets haixun wang, wei wang, philip s. yu, jiong yang 2002"
44,conf/sigmod/Rodriguez-Martinez00,"mocha: a database middleware system featuring automatic deployment of application-specific functionality manuel rodriguez-martinez, joseph jájá, john m. mcgann, nick roussopoulos, zhexuan song, stephen kelley, vadim katz 2000"
45,conf/sigmod/ChenDLT00,"fact: a learning based web query processing system zengping tian, hongjun lu, yanlei diao, songting chen 2000"
46,journals/sigmod/MeltonE01,"sql multimedia and application packages (sql/mm) jim melton, andrew eisenberg 2001"
47,conf/vldb/Sheth96,bellcore's adapt/x harness system for managing information on internet and intranets amit p. sheth 1996
48,conf/sigmod/Larson01,xml data management go native or spruce up relational systems? (panel abstract) per-åke larson 2001
49,journals/sigmod/ChaudhuriD97,"an overview of data warehousing and olap technology surajit chaudhuri, umeshwar dayal 1997"
50,conf/sigmod/BersonGMJ94,"staggered striping in multimedia information systems steven berson, richard r. muntz, shahram ghandeharizadeh, xiangyu ju 1994"
51,journals/sigmod/GerlaX03,"multimedia streaming in large-scale sensor networks with mobile swarms mario gerla, kaixin xu 2003"
52,journals/sigmod/Klein94,how to modify sql queries in order to guarantee sure answers hans-joachim klein 1994
53,conf/vldb/PirotteZMY94,"materialization: a powerful and ubiquitous abstraction pattern alain pirotte, esteban zimányi, tatiana yakusheva, david massart 1994"
54,conf/sigmod/DattaDRTV01,"dynamic content acceleration: a caching solution to enable scalable dynamic web page generation debra e. vandermeer, krithi ramamritham, helen m. thomas, anindya datta, kaushik dutta 2001"
55,journals/sigmod/Bertram94,data modelling in the large martin bertram 1994
56,conf/sigmod/TatarinovIHW01,"updating xml daniel s. weld, zachary g. ives, igor tatarinov, alon y. halevy 2001"
57,journals/sigmod/RoantreeS02,"research in information managment at dublin city university alan f. smeaton, mark roantree 2002"
58,conf/sigmod/BaumannDFRW98,"the multidimensional database system rasdaman andreas dehmel, peter baumann, norbert widmann, roland ritsch, paula furtado 1998"
59,conf/vldb/AnSVKIG01,"analyzing energy behavior of spatial access methods for memory-resident data anand sivasubramaniam, sudhanva gurumurthi, narayanan vijaykrishnan, ning an, mary jane irwin, mahmut t. kandemir 2001"
60,conf/vldb/Graefe99,the value of merge-join and hash-join in sql server goetz graefe 1999
61,conf/sigmod/Weininger02,efficient execution of joins in a star schema andreas weininger 2002
62,conf/vldb/ChristopheBPV00,"picodmbs: scaling down database techniques for the smartcard luc bouganim, patrick valduriez, philippe pucheral, christophe bobineau 2000"
63,conf/vldb/JagadishKNS99,"multi-dimensional substring selectivity estimation divesh srivastava, olga kapitskaia, raymond t. ng, h. v. jagadish 1999"
64,journals/vldb/HarderST99,"the intrinsic problems of structural heterogeneity and an approach to their solution theo härder, joachim thomas, günter sauter 1999"
65,conf/sigmod/Mohan99,a database perspective on lotus domino/notes c. mohan 1999
66,journals/sigmod/Camps96,"domains, relations and religious wars rafael camps 1996"
67,conf/vldb/Shenker03,the data-centric revolution in networking scott shenker 2003
68,conf/sigmod/DeshpandeNGS03,"cache-and-query for wide area sensor databases phillip b. gibbons, srinivasan seshan, suman kumar nath, amol deshpande 2003"
69,conf/vldb/GardarinGT95,"a cost model for clustered object-oriented databases zhao-hui tang, jean-robert gruser, georges gardarin 1995"
70,conf/vldb/Garcia-MolinaLY98,"expiring data in a warehouse wilburt labio, jun yang, hector garcia-molina 1998"
71,journals/sigmod/Qian97,opportunities in information management and assurance xiaolei qian 1997
72,conf/vldb/EicklerKK97,"finding data in the neighborhood andré eickler, alfons kemper, donald kossmann 1997"
73,conf/sigmod/HristidisKP01,"prefer: a system for the efficient execution of multi-parametric ranked queries yannis papakonstantinou, vagelis hristidis, nick koudas 2001"
74,journals/sigmod/Liu02,editor's notes ling liu 2002
75,conf/sigmod/ZhangMCMR02,"rainbow: mapping-driven xquery processing system mukesh mulchandani, elke a. rundensteiner, xin zhang, brian murphy, steffen christ 2002"
76,journals/vldb/PoulovassilisS96,"algebraic query optimisation for database programming languages carol small, alexandra poulovassilis 1996"
77,journals/tods/AikenHW95,"static analysis techniques for predicting the behavior of active database rules alexander aiken, jennifer widom, joseph m. hellerstein 1995"
78,conf/sigmod/TheodoulidisAACKS94,"the ores temporal database management system babis theodoulidis, george karvelis, jayant chaudhary, aziz ait-braham, simon sou, george andrianopoulos 1994"
79,journals/tods/MumickFPR96,"magic conditions hamid pirahesh, inderpal singh mumick, raghu ramakrishnan, sheldon j. finkelstein 1996"
80,conf/vldb/MoserKK95,"l/mrp: a buffer management strategy for interactive continuous data flows in a multimedia dbms wolfgang klas, frank moser, achim kraiss 1995"
81,conf/sigmod/Spiro98,"ubiquitous, self-tuning, scalable servers peter m. spiro 1998"
82,conf/vldb/Sarawagi99,explaining differences in multidimensional aggregates sunita sarawagi 1999
83,conf/vldb/WuYCT95,"a performance study of workfile disk management for concurrent mergesorts in a multiprocessor database system kun-lung wu, philip s. yu, james z. teng, jen-yao chung 1995"
84,conf/sigmod/Vaskevitch94,database in crisis and transition: a technical agenda for the year 2001 david vaskevitch 1994
85,conf/sigmod/Sheth95,"workflow automation: applications, technology, and research (tutorial) amit p. sheth 1995"
86,journals/sigmod/KantM00,"workshop on performance and architecture of web servers (paws-2000, held in conjection with sigmetrics-2000) krishna kant, prasant mohapatra 2000"
87,conf/vldb/PottingerL00,"a scalable algorithm for answering queries using views rachel pottinger, alon y. levy 2000"
88,journals/sigmod/Snodgrass02,why i like working in academia richard t. snodgrass 2002
89,conf/sigmod/GionisGK01,"efficient and tunable similar set retrieval dimitrios gunopulos, aristides gionis, nick koudas 2001"
90,conf/vldb/ChakrabartiRS02,"fast and accurate text classification via multiple linear discriminant projections mahesh v. soundalgekar, soumen chakrabarti, shourya roy 2002"
91,conf/vldb/DayalHL01,"business process coordination: state of the art, trends, and open issues meichun hsu, rivka ladin, umeshwar dayal 2001"
92,conf/vldb/Bowker00,work and information practices in the sciences of biodiversity geoffrey c. bowker 2000
93,conf/sigmod/GibbsBT94,"data modeling of time-based media simon j. gibbs, christian breiteneder, dennis tsichritzis 1994"
94,journals/tods/SrivastavaSRN95,"space optimization in deductive databases s. sudarshan, divesh srivastava, raghu ramakrishnan, jeffrey f. naughton 1995"
95,journals/sigmod/Snodgrass00a,chair's message richard t. snodgrass 2000
96,journals/sigmod/Alonso94b,trade press news - announcement and preface rafael alonso 1994
97,conf/sigmod/ChenGM01,"improving index performance through prefetching shimin chen, todd c. mowry, phillip b. gibbons 2001"
98,journals/sigmod/Qian96b,new programs at darpa and nsf xiaolei qian 1996
99,conf/vldb/PoulovassilisS94,"investigation of algebraic query optimisation techniques for database programming languages alexandra poulovassilis, carol small 1994"
100,conf/vldb/DeutschPT99,"physical data independence, constraints, and optimization with universal plans lucian popa, alin deutsch, val tannen 1999"
101,conf/sigmod/IvesFFLW99,"an adaptive query execution system for data integration daniel s. weld, alon y. levy, marc friedman, zachary g. ives, daniela florescu 1999"
102,conf/vldb/Sondag01,the semantic web paving the way to the knowledge society pierre-paul sondag 2001
103,conf/vldb/ShaferA97,"parallel algorithms for high-dimensional similarity joins for data mining applications rakesh agrawal, john c. shafer 1997"
104,journals/tods/DiaoAFZF03,"path sharing and predicate evaluation for high-performance xml filtering yanlei diao, hao zhang, peter m. fischer, michael j. franklin, mehmet altinel 2003"
105,conf/sigmod/GangulyGR03,"processing set expressions over continuous update streams sumit ganguly, minos n. garofalakis, rajeev rastogi 2003"
106,conf/vldb/Johnson99,performance measurements of compressed bitmap indices theodore johnson 1999
107,conf/vldb/ChanI99,"hierarchical prefix cubes for range-sum queries chee yong chan, yannis e. ioannidis 1999"
108,journals/tods/WijesekeraJPH03,"removing permissions in the flexible authorization framework åsa hagström, duminda wijesekera, francesco parisi-presicce, sushil jajodia 2003"
109,conf/sigmod/AmbiteABKMMMPT98,"ariadne: a system for constructing mediators for internet sources ion muslea, greg barish, andrew philpot, craig a. knoblock, steven minton, josé luis ambite, pragnesh jay modi, sheila tejada, naveen ashish 1998"
110,journals/tods/MamoulisP01,"multiway spatial joins dimitris papadias, nikos mamoulis 2001"
111,conf/sigmod/HarinarayanRU96,"implementing data cubes efficiently anand rajaraman, jeffrey d. ullman, venky harinarayan 1996"
112,journals/sigmod/MattosD94,"recent design trade-offs in sql3 nelson mendonça mattos, linda g. demichiel 1994"
113,journals/sigmod/EisenbergM99a,"sqlj-part 1: sql routines using the java programming language andrew eisenberg, jim melton 1999"
114,conf/sigmod/RafieiM97,"similarity-based queries for time series data alberto o. mendelzon, davood rafiei 1997"
115,journals/sigmod/PapianiWDN99,"a distributed scientific data archive using the web, xml and sql/med alistair n. dunlop, jasmin l. wason, denis a. nicole, mark papiani 1999"
116,conf/vldb/HeymannTKWRMF02,"viator - a tool family for graphical networking and data view creation katja tham, axel kilian, dieter merkel, peter rieger, stephan heymann, gunnar wegner, johann christoph freytag 2002"
117,journals/sigmod/Jagadish01,information warfare and security - book review h. v. jagadish 2001
118,conf/vldb/Norvag99,the persistent cache: improving oid indexing in temporal object-oriented database systems kjetil nørvåg 1999
119,conf/vldb/BelussiF95,"estimating the selectivity of spatial queries using the `correlation' fractal dimension christos faloutsos, alberto belussi 1995"
120,journals/vldb/AslanM99,"semantic heterogeneity resolution in federated databases by metadata implantation and stepwise evolution dennis mcleod, goksel aslan 1999"
121,journals/sigmod/YeungHL94,"performance evaluation of a new distributed deadlock detection algorithm chim-fu yeung, kam-yiu lam, sheung-lun hung 1994"
122,journals/sigmod/MeltonMJKSZ01,"sql and management of external data jan-eike michels, jim melton, krishna g. kulkarni, peter m. schwarz, kathy zeidenstein, vanja josifovski 2001"
123,conf/vldb/LernerS03,"aquery: query language for ordered data, optimization techniques, and experiments alberto lerner, dennis shasha 2003"
124,conf/vldb/GarofalakisOS97,"resource scheduling in enhanced pay-per-view continuous media databases banu özden, minos n. garofalakis, abraham silberschatz 1997"
125,conf/sigmod/ShouCTRH01,"review: a real time virtual walkthrough system yixin ruan, zhiyong huang, kian-lee tan, jason chionh, lidan shou 2001"
126,journals/tods/TendickM94,"a modified random perturbation method for database security norman s. matloff, patrick tendick 1994"
127,conf/sigmod/Suciu99,managing web data dan suciu 1999
128,conf/vldb/Raghavan96,loading the data warehouse across various parallel architectures vijay v. raghavan 1996
129,journals/sigmod/KarlapalemLS95,"hodfa: an architectural framework for homogenizing heterogeneous legacy database qing li, kamalakar karlapalem, chung-dak shum 1995"
130,conf/vldb/ShashaB02,"database tuning: principles, experiments, and troubleshooting techniques philippe bonnet, dennis shasha 2002"
131,journals/sigmod/RossGN03,"reminiscences an influential papers jeffrey f. naughton, minos n. garofalakis, kenneth a. ross 2003"
132,journals/sigmod/Zhang95,application of oodb and sgml techniques in text database: an electronic dictionary system jian zhang 1995
133,conf/sigmod/ClossmanSHKPB98,"java and relational databases: sqlj (tutorial) johannes klein, richard pledereder, gray clossman, brian becker, phil shaw, mark hapner 1998"
134,conf/sigmod/KaushikBNK02,"covering indexes for branching path queries raghav kaushik, henry f. korth, jeffrey f. naughton, philip bohannon 2002"
135,conf/sigmod/LiC95,"semint: a system prototype for semantic integration in heterogeneous databases wen-syan li, chris clifton 1995"
136,journals/sigmod/LabrinidisM01,"career-enhancing services at sigmod online alexandros labrinidis, alberto o. mendelzon 2001"
137,conf/sigmod/GuptaHR97,"revisiting commit processing in distributed database systems krithi ramamritham, jayant r. haritsa, ramesh gupta 1997"
138,journals/tods/Alagic99,type-checking oql queries in the odmg type systems suad alagic 1999
139,conf/sigmod/Golding95,things every update replication customer should know rob golding 1995
140,journals/sigmod/Jonsson03,in memory of gísli r. hjaltason björn þór jónsson 2003
141,conf/vldb/LevyMS94,"query optimization by predicate move-around inderpal singh mumick, alon y. levy, yehoshua sagiv 1994"
142,conf/sigmod/FernandezFKLS98,"catching the boat with strudel: experiences with a web-site management system jaewoo kang, dan suciu, alon y. levy, daniela florescu, mary f. fernandez 1998"
143,conf/sigmod/SlivinskasJS01,"adaptable query optimization and evaluation in temporal middleware christian s. jensen, richard t. snodgrass, giedrius slivinskas 2001"
144,conf/sigmod/ZhangRL96,"birch: an efficient data clustering method for very large databases raghu ramakrishnan, miron livny, tian zhang 1996"
145,conf/sigmod/TaoP02,"time-parameterized queries in spatio-temporal databases dimitris papadias, yufei tao 2002"
146,conf/sigmod/HanKK97,"scalable parallel data mining for association rules eui-hong han, vipin kumar, george karypis 1997"
147,journals/tods/BaralisW00,"an algebraic approach to static analysis of active database rules jennifer widom, elena baralis 2000"
148,conf/vldb/CatozziR95,"os support for vldbs: unix enhancements for the teradata data base sorana rabinovici, john catozzi 1995"
149,conf/sigmod/SismanisDRK02,"dwarf: shrinking the petacube yannis kotidis, yannis sismanis, antonios deligiannakis, nick roussopoulos 2002"
150,conf/sigmod/PiatkoYLS96,"thinksheet: a tool for tailoring complex documents dao-i lin, peter piatko, roman yangarber, dennis shasha 1996"
151,conf/sigmod/ZouS96,"on-line reorganization of sparsely-populated b+trees betty salzberg, chendong zou 1996"
152,conf/sigmod/Weininger00,handling very large databases with informix extended parallel server andreas weininger 2000
153,conf/vldb/ChaudhuriS94,"including group-by in query optimization surajit chaudhuri, kyuseok shim 1994"
154,conf/vldb/BestavrosB95,"value-cognizant speculative concurrency control azer bestavros, spyridon braoudakis 1995"
155,journals/sigmod/Geller02,data mining: practical machine learning tools and techniques - book review james geller 2002
156,journals/sigmod/LenzeriniNNS01,"report on the 8th international workshop on knowledge representation meets databases (krdb) dan suciu, maurizio lenzerini, daniele nardi, werner nutt 2001"
157,conf/sigmod/GravanoCGP97,"starts: stanford proposal for internet meta-searching (experience paper) hector garcia-molina, luis gravano, kevin chen-chuan chang, andreas paepcke 1997"
158,conf/vldb/BerchtoldKK96,"the x-tree : an index structure for high-dimensional data hans-peter kriegel, stefan berchtold, daniel a. keim 1996"
159,conf/vldb/AnanthakrishnaCG02,"eliminating fuzzy duplicates in data warehouses rohit ananthakrishna, venkatesh ganti, surajit chaudhuri 2002"
160,conf/vldb/KerstenWFKBC03,"a database striptease or how to manage your personal databases michael j. franklin, surajit chaudhuri, alejandro p. buchmann, gerhard weikum, daniel a. keim, martin l. kersten 2003"
161,conf/sigmod/DogacTPPLKTK02,"an ebxml infrastructure implementation through uddi registries and rosettanet pips yildiray kabak, gokce laleci, sait pektas, serkan toprak, yusuf tambag, gokhan kurt, asuman dogac, pinar pembecioglu 2002"
162,journals/sigmod/Bohlen95,temporal database system implementations michael h. böhlen 1995
163,conf/vldb/CohenMKS03,"xsearch: a semantic search engine for xml yaron kanza, yehoshua sagiv, sara cohen, jonathan mamou 2003"
164,conf/vldb/HaberIL95,"opossum: desk-top schema management through customizable visualization miron livny, eben m. haber, yannis e. ioannidis 1995"
165,journals/tods/SchuldtABS02,"atomicity and isolation for transactional processes hans-jörg schek, gustavo alonso, heiko schuldt, catriel beeri 2002"
166,conf/sigmod/LometT99,"logical logging to extend recovery to new domains david b. lomet, mark r. tuttle 1999"
167,conf/sigmod/FlokstraKS94,"the impress ddt: a database design toolbox based on a formal specification language jacek skowronek, maurice van keulen, jan flokstra 1994"
168,conf/sigmod/HellersteinHW97,"online aggregation helen j. wang, peter j. haas, joseph m. hellerstein 1997"
169,conf/sigmod/CookKWZ96,"semi-automatic, self-adaptive control of garbage collection rates in object databases artur klauser, alexander l. wolf, benjamin g. zorn, jonathan e. cook 1996"
170,conf/vldb/Mihalisin98,a single pass computing engine for interactive analysis of vldbs ted mihalisin 1998
171,conf/vldb/KornSFSP96,"fast nearest neighbor search in medical image databases zenon protopapas, christos faloutsos, eliot siegel, flip korn, nikolaos sidiropoulos 1996"
172,journals/sigmod/KlasS94,"metadata for digital media: introduction to the special issue amit p. sheth, wolfgang klas 1994"
173,journals/sigmod/Darwen96,"in reply to domains, relations and religious wars hugh darwen 1996"
174,conf/vldb/CarinoJ98,"bank of america case study: the information currency advantage mark jahnke, felipe cariño 1998"
175,journals/vldb/Amer-YahiaCLS02,"tree pattern query minimization divesh srivastava, sungran cho, laks v. s. lakshmanan, sihem amer-yahia 2002"
176,conf/sigmod/CareyFZ94,"fine-grained sharing in a page server oodbms michael j. carey, markos zaharioudakis, michael j. franklin 1994"
177,journals/sigmod/JenningsNF98,"adept: an agent-based approach to business process management timothy j. norman, nicholas r. jennings, peyman faratin 1998"
178,journals/sigmod/Labrinidis01,introduction to the career forum column alexandros labrinidis 2001
179,conf/sigmod/HsuLG00,"image mining in iris: integrated retinal information system kheng guan goh, wynne hsu, mong-li lee 2000"
180,conf/sigmod/Melling94,enterprise information architectures -- they're finally changing wesley p. melling 1994
181,conf/vldb/Mattos03,integrating information for on demand computing nelson mendonça mattos 2003
182,journals/vldb/BenzakenD95,"thémis: a database programming language handling integrity constraints anne doucet, véronique benzaken 1995"
183,journals/vldb/RamamohanaraoH94,"an introduction to deductive database languages and systems kotagiri ramamohanarao, james harland 1994"
