,id,info
1830,conf/vldb/BelloDDFNSWZ98,"materialized views in oracle randall g. bello, william d. norcott, mohamed ziauddin, harry sun, karl dias, alan downing, james j. feenan jr., andrew witkowski, james l. finnerty 1998"
1831,conf/vldb/AmielBDS94,"supporting exceptions to schema consistency to ease schema evolution in oodbms eric dujardin, eric simon, marie-jo bellosta, eric amiel 1994"
1832,journals/sigmod/CaplinskasEV02,"advances in databases and information systems (adbis) albertas caplinskas, johann eder, olegas vasilecas 2002"
1833,conf/vldb/Moerkotte98,small materialized aggregates: a light weight index structure for data warehousing guido moerkotte 1998
1834,journals/vldb/WhangKW94,"dynamic maintenance of data distribution for selectivity estimation kyu-young whang, gio wiederhold, sang-wook kim 1994"
1835,conf/sigmod/MatiasVW98,"wavelet-based histograms for selectivity estimation jeffrey scott vitter, yossi matias, min wang 1998"
1836,conf/vldb/Sarawagi02,automation in information extraction and data integration sunita sarawagi 2002
1837,conf/sigmod/BarclaySG00,"terraserver: a spatial data warehouse donald r. slutz, jim gray, tom barclay 2000"
1838,conf/sigmod/Pruscino03,oracle rac: architecture and performance angelo pruscino 2003
1839,conf/vldb/IshikawaSF98,"mindreader: querying databases through multiple examples ravishankar subramanya, christos faloutsos, yoshiharu ishikawa 1998"
1840,conf/vldb/ChanFFGR02,"tree pattern aggregation for scalable xml data dissemination rajeev rastogi, pascal felber, chee yong chan, wenfei fan, minos n. garofalakis 2002"
1841,conf/sigmod/Jhingran00,anatomy of a real e-commerce system anant jhingran 2000
1842,conf/vldb/UrhanF01,"dynamic pipeline scheduling for improving interactive query performance tolga urhan, michael j. franklin 2001"
1843,journals/tods/DeySB99,"improving database design through the analysis of relationships veda c. storey, terence m. barron, debabrata dey 1999"
1844,journals/sigmod/Cetintemel01,on the academic interview circuit: an end-to-end discussion ugur çetintemel 2001
1845,conf/vldb/ZhuS02,"statstream: statistical monitoring of thousands of data streams in real time yunyue zhu, dennis shasha 2002"
1846,conf/vldb/Brodie00,"panel: future directions of database research - the vldb broadening strategy, part 2 michael l. brodie 2000"
1847,conf/vldb/TengCY03,"a regression-based temporal pattern mining scheme for data streams philip s. yu, wei-guang teng, ming-syan chen 2003"
1848,journals/sigmod/Grefen02,what will be - book review paul w. p. j. grefen 2002
1849,conf/sigmod/PaparizosACJLNPSWWY03,"timber: a native system for querying xml laks v. s. lakshmanan, stelios paparizos, nuwee wiwatwattana, cong yu, jignesh m. patel, h. v. jagadish, andrew nierman, divesh srivastava, adriane chapman, yuqing wu, shurug al-khalifa 2003"
1850,conf/vldb/NgH94,"efficient and effective clustering methods for spatial data mining raymond t. ng, jiawei han 1994"
1851,journals/sigmod/BarclayBGS94,"loading databases using dataflow parallelism prakash sundaresan, jim gray, robert barnes, tom barclay 1994"
1852,conf/vldb/MillinerBP95,"a scalable architecture for autonomous heterogeneous database interactions athman bouguettaya, steven milliner, mike p. papazoglou 1995"
1853,conf/vldb/SenkulKT02,"a logical framework for scheduling workflows under resource allocation constraints michael kifer, pinar senkul, ismail h. toroslu 2002"
1854,conf/vldb/ZimbraoS98,"a raster approximation for processing of spatial joins jano moreira de souza, geraldo zimbrao 1998"
1855,conf/sigmod/YuMWL01,"efficient and effective metasearch for text databases incorporating linkages among documents weiyi meng, clement t. yu, king-lup liu, wensheng wu 2001"
1856,conf/sigmod/AcharyaFZ97,"balancing push and pull for data broadcast swarup acharya, stanley b. zdonik, michael j. franklin 1997"
1857,journals/sigmod/SlivinskasJS02,"bringing order to query optimization giedrius slivinskas, richard t. snodgrass, christian s. jensen 2002"
1858,conf/vldb/Gupta96,the changing landscape of the software industry and its implications for india umang gupta 1996
1859,conf/vldb/TamuraK99,"dynamic load balancing for parallel association rule mining on heterogenous pc cluster systems masahisa tamura, masaru kitsuregawa 1999"
1860,conf/sigmod/FreedmanD95,"the spiffi scalable video-on-demand system craig s. freedman, david j. dewitt 1995"
1861,conf/vldb/KamelF94,"hilbert r-tree: an improved r-tree using fractals ibrahim kamel, christos faloutsos 1994"
1862,conf/vldb/HaasKU99,"loading a cache with query results ioana ursu, donald kossmann, laura m. haas 1999"
1863,conf/sigmod/SelfridgeSW96,"idea: interactive data exploration and analysis lynn o. wilson, peter g. selfridge, divesh srivastava 1996"
1864,conf/sigmod/WangJLY03,"containment join size estimation: models and methods haifeng jiang, hongjun lu, wei wang, jeffrey xu yu 2003"
1865,conf/vldb/MurthyB03,"xml schemas in oracle xml db sandeepan banerjee, ravi murthy 2003"
1866,conf/sigmod/Keim96,databases and visualization daniel a. keim 1996
1867,journals/sigmod/ElmagarmidJF95,"wireless client/server computing for personal information services and applications jin jing, tetsuya furukawa, ahmed k. elmagarmid 1995"
1868,journals/sigmod/ArenasKKKMM03,"the hyperion project: from data integration to data coordination marcelo arenas, vasiliki kantere, renée j. miller, anastasios kementsietsidis, john mylopoulos, iluju kiringa 2003"
1869,conf/sigmod/BohannonMR01,"main-memory index structures with fixed-size partial keys philip bohannon, rajeev rastogi, peter mcilroy 2001"
1870,conf/sigmod/DreyerDS95,"using the calanda time series management system werner dreyer, angelika kotz dittrich, duri schmidt 1995"
1871,conf/sigmod/LiBCS00,"spire: a progressive content-based spatial image retrieval engine chung-sheng li, vittorio castelli, lawrence d. bergman, john r. smith 2000"
1872,journals/vldb/EvangelidisS97,"the hb-pi-tree: a multi-attribute index supporting concurrency, recovery and node consolidation betty salzberg, david b. lomet, georgios evangelidis 1997"
1873,journals/vldb/C94b,"title, foreword ? 1994"
1874,conf/sigmod/LakshmananNHP99,"optimization of constrained frequent set queries with 2-variable constraints laks v. s. lakshmanan, alex pang, raymond t. ng, jiawei han 1999"
1875,journals/sigmod/Halevy03,learning about data integration challenges from day one alon y. halevy 2003
1876,conf/sigmod/KornMZ03,"ipsofacto: a visual correlation tool for aggregate network traffic data yunyue zhu, s. muthukrishnan, flip korn 2003"
1877,conf/sigmod/WangSCRZP97,"structural matching and discovery in document databases jason tsong-li wang, george jyh-shian chang, dennis shasha, girish patel, kaizhong zhang, liam relihan 1997"
1878,journals/vldb/HansonCDERTX98,"a flexible and recoverable client/server database event notification system chun xu, eric n. hanson, roxana dastur, i.-cheng chen, vijay ramaswamy, wendy tan, kurt engel 1998"
1879,conf/sigmod/KeoghCMP01,"locally adaptive dimensionality reduction for indexing large time series databases kaushik chakrabarti, sharad mehrotra, eamonn j. keogh, michael j. pazzani 2001"
1880,conf/sigmod/LivnyRBCDLMW97a,"devise: integrated querying and visual exploration of large datasets (demo abstract) jussi myllymaki, shilpa lawande, donko donjerkovic, raghu ramakrishnan, guangshun chen, kevin s. beyer, miron livny, r. kent wenger 1997"
1881,journals/sigmod/SayginVC01,"using unknowns to prevent discovery of association rules chris clifton, yücel saygin, vassilios s. verykios 2001"
1882,journals/sigmod/Ritter98,the middleware muddle david ritter 1998
1883,conf/sigmod/ChenRW02,"xcache: a semantic caching system for xml queries elke a. rundensteiner, song wang, li chen 2002"
1884,conf/sigmod/Olson95,cover your assets michael a. olson 1995
1885,journals/vldb/SakuraiYUK02,"spatial indexing of high-dimensional data based on relative approximation shunsuke uemura, masatoshi yoshikawa, yasushi sakurai, haruhiko kojima 2002"
1886,conf/sigmod/McAuliffeCS96,"towards effective and efficient free space management marvin h. solomon, michael j. carey, mark l. mcauliffe 1996"
1887,conf/sigmod/DasGR03,"approximate join processing over data streams johannes gehrke, abhinandan das, mirek riedewald 2003"
1888,journals/vldb/C95,"title, announcement ? 1995"
1889,conf/vldb/WeberSB98,"a quantitative analysis and performance study for similarity-search methods in high-dimensional spaces stephen blott, roger weber, hans-jörg schek 1998"
1890,conf/vldb/Vingralek02,"gnatdb: a small-footprint, secure database system radek vingralek 2002"
1891,conf/sigmod/BeyerR99,"bottom-up computation of sparse and iceberg cubes kevin s. beyer, raghu ramakrishnan 1999"
1892,conf/sigmod/ChenGK01,"query optimization in compressed database systems zhiyuan chen, flip korn, johannes gehrke 2001"
1893,journals/sigmod/Snodgrass02b,"rights of tods readers, authors and reviewers richard t. snodgrass 2002"
1894,journals/sigmod/CalvaneseGLV03,"reasoning on regular path queries giuseppe de giacomo, moshe y. vardi, maurizio lenzerini, diego calvanese 2003"
1895,conf/vldb/NatsevCSLV01,"supporting incremental join queries on ranked inputs john r. smith, yuan-chi chang, chung-sheng li, jeffrey scott vitter, apostol natsev 2001"
1896,conf/sigmod/JagadishLS99,"snakes and sandwiches: optimal clustering strategies for a data warehouse laks v. s. lakshmanan, divesh srivastava, h. v. jagadish 1999"
1897,conf/sigmod/Bussler01,semantic b2b integration christoph bussler 2001
1898,conf/sigmod/DanS95,"an online video placement policy based on bandwith to space ratio (bsr) dinkar sitaram, asit dan 1995"
1899,journals/sigmod/Aberer02c,book review column karl aberer 2002
1900,journals/tods/GutingBEJLSV00,"a foundation for representing and quering moving objects michael h. böhlen, christian s. jensen, michalis vazirgiannis, nikos a. lorentzos, markus schneider, ralf hartmut güting, martin erwig 2000"
1901,conf/sigmod/HanKS97,"geominer: a system prototype for spatial data mining jiawei han, nebojsa stefanovic, krzysztof koperski 1997"
1902,conf/vldb/RosenthalS94,"data integration in the large: the challenge of reuse leonard j. seligman, arnon rosenthal 1994"
1903,conf/vldb/MengLLA03,"orientstore: a schema based native xml storage system jing an, mong-li lee, daofeng luo, xiaofeng meng 2003"
1904,conf/vldb/KornMS02,"reverse nearest neighbor aggregates over data streams flip korn, s. muthukrishnan, divesh srivastava 2002"
1905,journals/sigmod/Segev94,editor's notes arie segev 1994
1906,conf/vldb/SakuraiYKU01,"similarity search for adaptive ellipsoid queries using spatial transformation yasushi sakurai, shunsuke uemura, masatoshi yoshikawa, ryoji kataoka 2001"
1907,journals/tods/YanG94,"index structures for selective dissemination of information under the boolean model tak w. yan, hector garcia-molina 1994"
1908,conf/sigmod/Maguire01,catalog management in websphere commerce suite thomas maguire 2001
1909,conf/sigmod/BabcockO03,"distributed top-k monitoring chris olston, brian babcock 2003"
1910,conf/sigmod/GuptaMR95,"adapting materialized views after redefinitions ashish gupta, inderpal singh mumick, kenneth a. ross 1995"
1911,journals/sigmod/NascimentoSP03,"analysis of sigmod's co-authorship graph mario a. nascimento, jörg sander, jeffrey pound 2003"
1912,conf/sigmod/RundensteinerCCSO00,"serfing the web: web site management made easy kajal t. claypool, elke a. rundensteiner, hong su, keiji oenoki, li chen 2000"
1913,journals/vldb/C94,"title, foreword ? 1994"
1914,journals/sigmod/RossCGJBV99,"reminiscences on influential papers jan van den bussche, surajit chaudhuri, moshe y. vardi, kenneth a. ross, gösta grahne, h. v. jagadish 1999"
1915,conf/sigmod/SionAP03,"rights protection for relational data sunil prabhakar, radu sion, mikhail j. atallah 2003"
1916,conf/sigmod/AdelbergD99,"nodose version 2.0 brad adelberg, matthew denny 1999"
1917,conf/vldb/SayalCDS02,"business process cockpit umeshwar dayal, mehmet sayal, ming-chien shan, fabio casati 2002"
1918,conf/vldb/BargaP95,"a practical and modular implementation of extended transaction models roger s. barga, calton pu 1995"
1919,conf/sigmod/ChenCPPSTM00,"internet traffic warehouse claudio petrone, marco mesiti, munir cochinwala, patrizia santa, chung-min chen, sunil samtani, marc pucci 2000"
1920,conf/sigmod/FernandezMS01,"efficient evaluation of xml middle-ware queries mary f. fernandez, dan suciu, atsuyuki morishima 2001"
1921,conf/vldb/OzsuLON01,"an extendible hash for multi-precision similarity querying of image databases m. tamer özsu, shu lin, raymond t. ng, vincent oria 2001"
1922,journals/tods/ChoG03,"effective page refresh policies for web crawlers junghoo cho, hector garcia-molina 2003"
1923,journals/sigmod/ChenHKPW94,"metadata for mixed-media access julian kupiec, jan o. pedersen, lynn wilcox, marti a. hearst, francine chen 1994"
1924,conf/vldb/SevcikK96,"filter trees for managing spatial data over a range of size granularities kenneth c. sevcik, nick koudas 1996"
1925,journals/sigmod/CfP99,"the active database central, er2000, vldb 2000, wise 2000, books, acm dl ? 1999"
1926,conf/vldb/MatiasVW00,"dynamic maintenance of wavelet-based histograms yossi matias, jeffrey scott vitter, min wang 2000"
1927,conf/sigmod/WangPFY03,"vist: a dynamic index method for querying xml data by tree structures wei fan, sanghyun park, philip s. yu, haixun wang 2003"
1928,journals/vldb/DanYC95,"characterization of database access pattern for analytic prediction of buffer hit probability jen-yao chung, asit dan, philip s. yu 1995"
1929,journals/sigmod/MillerHHYHFP01,"the clio project: managing heterogeneity renée j. miller, c. t. howard ho, lucian popa, ling-ling yan, ronald fagin, mauricio a. hernández, laura m. haas 2001"
1930,conf/vldb/GravanoG97,"merging ranks from heterogeneous internet sources hector garcia-molina, luis gravano 1997"
1931,conf/sigmod/ChawatheG97,"meaningful change detection in structured data hector garcia-molina, sudarshan s. chawathe 1997"
1932,conf/vldb/GarofalakisG02,"querying and mining data streams: you only get one look minos n. garofalakis, johannes gehrke 2002"
1933,conf/vldb/FlorescuLS98,"is web-site management a database problem? daniela florescu, dan suciu, alon y. levy 1998"
1934,conf/vldb/Kuhn03,the zero-delay data warehouse: mobilizing heterogeneous databases eva kühn 2003
1935,journals/sigmod/LudwigG00,"report in isdo '00: the caise*00 workshop on infrastructures for dynamic business-to-business service outsourcinga paul w. p. j. grefen, heiko ludwig 2000"
1936,conf/vldb/SrinivasanDFCJYKTDB00,"oracle8i index-organized table and its application to new domains anh-tuan tran, chuck freiwald, aravind yalamanchi, samuel defazio, souripriya das, ramkumar krishnan, jagannathan srinivasan, mahesh jagannath, eugene inseok chong, jayanta banerjee 2000"
1937,conf/vldb/SteenhagenABB94,"from nested-loop to join queries in oodb peter m. g. apers, hennie j. steenhagen, henk m. blanken, rolf a. de by 1994"
1938,conf/sigmod/ChristophidesCS00,"on wrapping query languages and efficient xml integration jérôme siméon, vassilis christophides, sophie cluet 2000"
1939,journals/sigmod/RashidS00,"object database evolution using separation of concerns peter sawyer, awais rashid 2000"
1940,conf/vldb/Schoning03,commercial use of database technology harald schöning 2003
1941,journals/sigmod/McClatcheyV97,"workshop on workflow management in scientific and engineering applications - report gottfried vossen, richard mcclatchey 1997"
1942,journals/tods/KorthS94,"formal aspects of concurrency control in long-duration transaction systems using the nt/pv model henry f. korth, gregory d. speegle 1994"
1943,conf/sigmod/JonssonFS98,"interaction of query evaluation and buffer management for information retrieval björn þór jónsson, divesh srivastava, michael j. franklin 1998"
1944,conf/vldb/ChaudhuriG99,"evaluating top-k selection queries luis gravano, surajit chaudhuri 1999"
1945,journals/sigmod/BusslerFM02,"a conceptual architecture for semantic web enabled web services dieter fensel, alexander maedche, christoph bussler 2002"
1946,journals/vldb/C95b,"title, preface to the special issue on persistent object systems ? 1995"
1947,conf/sigmod/BerchtoldBK98,"the pyramid-technique: towards breaking the curse of dimensionality christian böhm, hans-peter kriegel, stefan berchtold 1998"
1948,conf/sigmod/GillmannWSWW00,"a goal-driven auto-configuration tool for the distributed workflow management system mentor-lite german shegalov, gerhard weikum, wolfgang wonner, michael gillmann, jeanine weißenfels 2000"
1949,conf/vldb/LimWPVP02,"xpathlearner: an on-line self-tuning markov histogram for xml path selectivity estimation lipyeow lim, ronald parr, jeffrey scott vitter, sriram padmanabhan, min wang 2002"
1950,conf/vldb/AgarwalADGNRS96,"on the computation of multidimensional aggregates sunita sarawagi, ashish gupta, rakesh agrawal, prasad deshpande, jeffrey f. naughton, sameet agarwal, raghu ramakrishnan 1996"
1951,conf/vldb/RantzauCHM02,"champagne: data change propagation for heterogeneous information systems holger meinecke, uwe heinkel, ralf rantzau, carmen constantinescu 2002"
1952,conf/sigmod/BohannonDGKLNS03,"rolex: relational on-line exchange with xml pradeep shenoy, xin dong, henry f. korth, philip bohannon, p. p. s. narayan, chengkai li, sumit ganguly 2003"
1953,conf/vldb/HulgeriS03,"anipqo: almost non-intrusive parametric query optimization for nonlinear cost functions arvind hulgeri, s. sudarshan 2003"
1954,conf/vldb/StohrR01,"warlock: a data allocation tool for parallel warehouses thomas stöhr, erhard rahm 2001"
1955,journals/sigmod/Franklin99,editor's notes michael j. franklin 1999
1956,conf/sigmod/AgrawalCFGHIIMMSS94,"quest: a project on database mining ramakrishnan srikant, balakrishna r. iyer, christos faloutsos, arun n. swami, h. miranda, sakti p. ghosh, a. mahboob, maurice a. w. houtsma, michael j. carey, tomasz imielinski, rakesh agrawal 1994"
1957,conf/vldb/ChaHKK01,"cache-conscious concurrency control of main-memory indexes on shared-memory multiprocessor systems sangyong hwang, kihong kim, sang kyun cha, keunjoo kwon 2001"
1958,conf/sigmod/HernandezMHYHT01,"clio: a semi-automatic tool for schema mapping laura m. haas, renée j. miller, mauricio a. hernández 2001"
1959,conf/sigmod/HillyerS96,"random i/o scheduling in online tertiary storage systems bruce hillyer, abraham silberschatz 1996"
1960,journals/sigmod/MedskerCS95,"a comparison of three user interfaces to relational microcomputer data bases carl medsker, margaret christensen, il-yeol song 1995"
1961,conf/vldb/CosleyLP02,"referee: an open framework for practical testing of recommender systems using researchindex dan cosley, steve lawrence, david m. pennock 2002"
1962,conf/vldb/PereiraFLS00,"publish/subscribe on the web at extreme speed dennis shasha, radu preotiuc-pietro, joão pereira, kenneth a. ross, françois llirbat, françoise fabret 2000"
1963,journals/sigmod/GottlobKP03,"xpath processing in a nutshell georg gottlob, christoph koch, reinhard pichler 2003"
1964,conf/sigmod/GatziuGD95,"the samos active dbms prototype klaus r. dittrich, stella gatziu, andreas geppert 1995"
1965,conf/vldb/BassiliadesV95,"a non-uniform data fragmentation strategy for parallel main-menory database systems nick bassiliades, ioannis p. vlahavas 1995"
1966,conf/sigmod/Bosworth03,the future of web services - i adam bosworth 2003
1967,journals/vldb/LiCHH01,"supporting efficient multimedia database exploration k. selçuk candan, yoshinori hara, kyoji hirata, wen-syan li 2001"
1968,journals/vldb/BunemanFS00,"unql: a query language and algebra for semistructured data based on structural recursion mary f. fernandez, peter buneman, dan suciu 2000"
1969,conf/vldb/StohrMR00,"multi-dimensional database allocation for parallel data warehouses holger märtens, erhard rahm, thomas stöhr 2000"
1970,conf/vldb/LockemannKKKN97,"the network as a global database: challenges of interoperability, proactivity, interactiveness, legacy arne koschel, ralf kramer, ralf nikolai, peter c. lockemann, mechtild wallrath, ulrike kölsch, hans-dirk walter 1997"
1971,conf/vldb/NetzCBF00,"integration of data mining with database technology amir netz, surajit chaudhuri, jeff bernhardt, usama m. fayyad 2000"
1972,conf/vldb/Greco98,binding propagation in disjunctive databases sergio greco 1998
1973,conf/vldb/GrumbachRS00,"manipulating interpolated data is easier than you thought stéphane grumbach, philippe rigaux, luc segoufin 2000"
1974,conf/sigmod/NgWY01,"iceberg-cube computation with pc clusters yu yin, raymond t. ng, alan s. wagner 2001"
1975,conf/vldb/LabioYCGW00,"performance issues in incremental warehouse maintenance hector garcia-molina, wilburt labio, yingwei cui, jennifer widom, jun yang 2000"
1976,journals/sigmod/Snodgrass97a,chair's message richard t. snodgrass 1997
1977,journals/sigmod/Gunther97,environment information systems - guest editor's foreword oliver günther 1997
1978,journals/sigmod/PuSW01,"infosphere project: system support for information flow applications calton pu, jonathan walpole, karsten schwan 2001"
1979,journals/sigmod/WenLMZ03,"a multi-paradigm querying approach for a generic multimedia database management system ji-rong wen, qing li, wei-ying ma, hongjiang zhang 2003"
1980,journals/sigmod/McHughW97,"integrating dynamically-fetched external information into a dbms for semistructured data jennifer widom, jason mchugh 1997"
1981,conf/vldb/ScheuermannSV96,"watchman : a data warehouse intelligent cache manager peter scheuermann, radek vingralek, junho shim 1996"
1982,journals/vldb/DattaDVRN01,"an architecture to support scalable online personalization on the web kaushik dutta, debra e. vandermeer, krithi ramamritham, anindya datta, shamkant b. navathe 2001"
1983,journals/vldb/BonifatiCP01,"active rules for xml: a new paradigm for e-services stefano ceri, stefano paraboschi, angela bonifati 2001"
1984,journals/sigmod/Gallagher94,influencing database language standards leonard gallagher 1994
1985,conf/sigmod/Tajima96,static detection of security flaws in object-oriented databases keishi tajima 1996
1986,journals/sigmod/WuY00,"report on second international workshop on advanced issues of e-commerce and web-based information systems philip s. yu, kun-lung wu 2000"
1987,journals/tods/CaldersNW02,"searching for dependencies at multiple abstraction levels jef wijsen, toon calders, raymond t. ng 2002"
1988,conf/sigmod/ShuklaD00,"tutorial: ldap directory services - just another database application? anand deshpande, shridhar shukla 2000"
1989,conf/sigmod/Jagadish94,databases for networks h. v. jagadish 1994
1990,conf/sigmod/WoelkBJOTU95,"carnot and infosleuth: database technology and the world wide web k. ong, christine tomlinson, darrell woelk, c. unnikrishnan, william bohrer, nigel jacobs 1995"
1991,journals/vldb/HalkidiNVV03,"thesus: organizing web document collections based on link semantics benjamin nguyen, iraklis varlamis, maria halkidi, michalis vazirgiannis 2003"
1992,journals/sigmod/Lomet98,b-tree page size when caching is considered david b. lomet 1998
1993,conf/vldb/GuptaHQ95,"aggregate-query processing in data warehousing environments venky harinarayan, dallan quass, ashish gupta 1995"
1994,conf/vldb/GravanoG95,"generalizing gloss to vector-space databases and broker hierarchies luis gravano, hector garcia-molina 1995"
1995,journals/sigmod/Hoffner03,fundamentals of data warehouses: 2nd revised and extended edition vernon hoffner 2003
1996,conf/sigmod/ArasuBBDIRW03,"stream: the stanford stream data manager jennifer widom, mayur datar, shivnath babu, justin rosenstein, itaru nishizawa, arvind arasu, keith ito, brian babcock 2003"
1997,conf/vldb/Baru96,performance of future database systems: bottlenecks and bonananzas chaitanya k. baru 1996
1998,conf/vldb/YanL95,"eager aggregation and lazy aggregation weipeng p. yan, per-åke larson 1995"
1999,journals/tods/WandSW99,"an ontological analysis of the relationship construct in conceptual modeling veda c. storey, yair wand, ron weber 1999"
2000,conf/vldb/ChaudhuriGS95,"retrieval of composite multimedia objects surajit chaudhuri, shahram ghandeharizadeh, cyrus shahabi 1995"
2001,conf/vldb/DattaRT99,"curio: a novel solution for efficient storage and indexing in data warehouses helen m. thomas, krithi ramamritham, anindya datta 1999"
2002,conf/vldb/RothOH99,"cost models do matter: providing cost information for diverse data sources in a federated system mary tork roth, laura m. haas, fatma ozcan 1999"
2003,conf/vldb/BernsteinPS99,"context-based prefetch for implementing objects on relations philip a. bernstein, david shutt, shankar pal 1999"
2004,journals/sigmod/Rosneblatt94,unix rdbms: the next generation bill rosneblatt 1994
2005,conf/vldb/ChoenniV00,design and implementation of a genetic-based algorithm for data mining sunil choenni 2000
2006,journals/sigmod/YauLMS99,"on multi-resolution document transmission in mobile web stanley m. t. yau, antonio si, dennis mcleod, hong va leong 1999"
2007,journals/vldb/RafieiM02,"efficient retrieval of similar shapes davood rafiei, alberto o. mendelzon 2002"
2008,journals/tods/BeneventanoBS03,"description logics for semantic query optimization in object-oriented database systems claudio sartori, sonia bergamaschi, domenico beneventano 2003"
2009,journals/vldb/JagadishKNS00,"one-dimensional and multi-dimensional substring selectivity estimation raymond t. ng, divesh srivastava, h. v. jagadish, olga kapitskaia 2000"
2010,conf/vldb/MarronL01,"on processing xml in ldap pedro josé marrón, georg lausen 2001"
